店名,場所,"緯度と経度",GMAPでみる,ぐーぐるの住所
ラウンドワン堺中央環状店,大阪府堺市東区石原町２−２４１,"34.5568702 135.5362542",https://www.google.com/search?q=34.5568702+135.5362542,日本、〒599-8102 大阪府堺市東区石原町２丁２４１ ラウンドワンスタジアム堺中央環状店
ラウンドワン千日前店,大阪府大阪市中央区難波１−３−１,"34.667458 135.5028281",https://www.google.com/search?q=34.667458+135.5028281,日本、〒542-0076 大阪府大阪市中央区難波１丁目３−１
遊スペース マジカル,兵庫県神戸市中央区琴ノ緒町５−２−３,"34.6955208 135.1950204",https://www.google.com/search?q=34.6955208+135.1950204,日本、〒651-0094 兵庫県神戸市中央区琴ノ緒町５丁目２−２−３
プレイステーションネーブル西宮店,兵庫県西宮市両度町6-10,"34.742516 135.3541586",https://www.google.com/search?q=34.742516+135.3541586,日本、〒662-0841 兵庫県西宮市両度町６−１０ 両度ビル
ゲームアイビス太子店,兵庫県揖保郡太子町太田2149,"34.8322966 134.5999777",https://www.google.com/search?q=34.8322966+134.5999777,日本、〒671-1511 兵庫県揖保郡太子町太田２１４９
ラウンドワン加古川店,兵庫県加古川市尾上町安田325番6号,"34.7470469 134.8368792",https://www.google.com/search?q=34.7470469+134.8368792,日本、〒675-0021 兵庫県加古川市尾上町安田３２５−６ ラウンドワン加古川店
ラウンドワン伊丹店,兵庫県伊丹市昆陽７丁目２９,"34.7789352 135.3937267",https://www.google.com/search?q=34.7789352+135.3937267,日本、〒664-0881 兵庫県伊丹市昆陽７丁目２９
ラウンドワン姫路飾磨店,兵庫県姫路市飾磨区中島１−２５４,"34.7925271 134.6867156",https://www.google.com/search?q=34.7925271+134.6867156,日本、〒672-8035 兵庫県姫路市飾磨区中島１丁目２５４
アミューズメントＣＵＥ奈良大和高田店,奈良県大和高田市東中２−１１−１６,"34.4996825 135.7355952",https://www.google.com/search?q=34.4996825+135.7355952,日本、〒635-0065 奈良県大和高田市東中２丁目１１−１６
ピタゴラス和歌山,和歌山県和歌山市土入７３−１,"34.2528626 135.145625",https://www.google.com/search?q=34.2528626+135.145625,日本、〒640-8432 和歌山県和歌山市土入７３−１
アミパラがいな店,鳥取県米子市日ノ出町１−８−１３,"35.4379198 133.3393106",https://www.google.com/search?q=35.4379198+133.3393106,日本、〒683-0803 鳥取県米子市日ノ出町１丁目８−１３
ＧｉＧＯ松江,島根県松江市嫁島町１２−１５,"35.4500899 133.0478343",https://www.google.com/search?q=35.4500899+133.0478343,日本、〒690-0047 島根県松江市嫁島町１２−１５ ゲームセンターセガワールド
ファンタジスタ,岡山県倉敷市新倉敷駅前５−１９４,"34.5583075 133.6767665",https://www.google.com/search?q=34.5583075+133.6767665,日本、〒710-0253 岡山県倉敷市新倉敷駅前５丁目１９４ ファンタジスタ
アミパラテクノランド店,岡山県岡山市北区大和町１−７−１２,"34.6791814 133.9275096",https://www.google.com/search?q=34.6791814+133.9275096,日本、〒700-0808 岡山県岡山市北区大和町１丁目７−１２ ゲームセンターアミパラ
アミパラ倉敷店,岡山県倉敷市西中新田624-1アミパラボウル1F,"34.583541 133.771306",https://www.google.com/search?q=34.583541+133.771306,日本、〒710-0833 岡山県倉敷市西中新田６２４−１
アミパラ岡山店,岡山県岡山市北区青江１丁目１３−８,"34.6362115 133.9199759",https://www.google.com/search?q=34.6362115+133.9199759,日本、〒700-0941 岡山県岡山市北区青江１丁目１３−８ Ａｍｉ Ｐａｒａ岡山店
ラウンドワン岡山妹尾店,岡山県岡山市南区妹尾３４１３−１,"34.6231034 133.8696472",https://www.google.com/search?q=34.6231034+133.8696472,日本、〒701-0205 岡山県岡山市南区妹尾３４１３−１ ラウンドワンスタジアム岡山妹尾店
タイトーステーション 広島紙屋町店,広島県広島市中区紙屋町２−２−２１,"34.3940529 132.4560844",https://www.google.com/search?q=34.3940529+132.4560844,日本、〒730-0031 広島県広島市中区紙屋町２丁目２−２１ 本通Thビル
アミパラここじゃ店,広島県東広島市西条町下見６−１０−１９,"34.4152617 132.7247156",https://www.google.com/search?q=34.41526169999999+132.7247156,日本、〒739-0044 広島県東広島市西条町下見
アミパラ神辺店,広島県福山市神辺町大字新道上字１−２−１,"34.5437908 133.3578252",https://www.google.com/search?q=34.5437908+133.3578252,日本、〒720-2107 広島県福山市神辺町新道上
ビバーチャ,広島県広島市中区南竹屋町１０−１７,"34.3794793 132.4613322",https://www.google.com/search?q=34.3794793+132.4613322,日本、〒730-0049 広島県広島市中区南竹屋町１０−１７ 広電アミューズメントスクエアビバーチャ
フタバ図書アルティランド,広島県広島市西区草津南４−７−１　アルパーク北棟２Ｆ,"34.3755962 132.393338",https://www.google.com/search?q=34.3755962+132.393338,日本、〒733-0863 広島県広島市西区草津南４丁目７−１ 2f
ラウンドワン広島店,広島県広島市中区立町３−１１,"34.3936679 132.4601026",https://www.google.com/search?q=34.3936679+132.4601026,日本、〒730-0032 広島県広島市中区立町３−１１ ラウンドワン広島店
アミパラ下関店,山口県下関市長府才川１−４２−４８,"34.0254431 131.0074938",https://www.google.com/search?q=34.0254431+131.0074938,日本、〒752-0928 山口県下関市長府才川１丁目４２−４８ アミパラ下関店
フレスパランドカッタの湯,山口県宇部市海南町1675,"33.9578337 131.262659",https://www.google.com/search?q=33.9578337+131.262659,日本、〒755-0038 山口県宇部市海南町
ラウンドワン徳島・万代店,徳島県徳島市万代町４−１９−１,"34.0648378 134.5646837",https://www.google.com/search?q=34.0648378+134.5646837,日本、〒770-0941 徳島県徳島市万代町４丁目１９−１ ラウンドワン徳島・万代店
ＧｉＧＯ高松,香川県高松市勅使町535,"34.3087327 134.0182065",https://www.google.com/search?q=34.3087327+134.0182065,日本、〒761-8058 香川県高松市勅使町５３５
ラウンドワン高松店,香川県高松市松島町２−７−４３,"34.3389147 134.0671184",https://www.google.com/search?q=34.3389147+134.0671184,日本、〒760-0068 香川県高松市松島町２丁目７−４３
アミューズメントパークＭＧ伊予三島,愛媛県四国中央市中之庄町７５−１　アイランド三島内,"33.974456 133.5285813",https://www.google.com/search?q=33.974456+133.5285813,日本、〒799-0422 愛媛県四国中央市中之庄町７５−１
ラウンドワン高知店,高知県高知市南宝永町４−１２,"33.5578084 133.554466",https://www.google.com/search?q=33.5578084+133.554466,日本、〒780-0816 高知県高知市南宝永町４−１２ ラウンドワン高知店
ｎａｍｃｏ博多バスターミナル店,福岡県福岡市博多区博多駅中央街２−１博多バスターミナル７階,"33.5913467 130.4191895",https://www.google.com/search?q=33.5913467+130.4191895,日本、〒812-0012 福岡県福岡市博多区博多駅中央街２−１
タイトーステーション 福岡天神店,福岡県福岡市中央区天神２−６−３５サザンクロスビル,"33.5896254 130.3972983",https://www.google.com/search?q=33.5896254+130.3972983,日本、〒810-0001 福岡県福岡市中央区天神２丁目６−３５
ペップ魚町,福岡県北九州市小倉北区魚町２−４−２０,"33.8839563 130.8801448",https://www.google.com/search?q=33.8839563+130.8801448,日本、〒802-0006 福岡県北九州市小倉北区魚町２丁目４−２０
楽市街道箱崎店,福岡県福岡市東区箱崎５丁目１番８号,"33.6242656 130.4197128",https://www.google.com/search?q=33.6242656+130.4197128,日本、〒812-0053 福岡県福岡市東区箱崎５丁目１−８ 楽市街道
楽市楽座福重店,福岡県福岡市西区石丸４−２６３−１,"33.5698263 130.3158817",https://www.google.com/search?q=33.5698263+130.3158817,日本、〒819-0025 福岡県福岡市西区石丸４丁目
ラウンドワン福岡天神店,福岡県福岡市中央区天神２−６−１２,"33.5891595 130.3970395",https://www.google.com/search?q=33.5891595+130.3970395,日本、〒810-0001 福岡県福岡市中央区天神２丁目６−１２ ほけんの窓口 福岡天神支店
ラウンドワン小倉店,福岡県北九州市小倉北区西港町15-65,"33.8973955 130.8597695",https://www.google.com/search?q=33.8973955+130.8597695,日本、〒803-0801 福岡県北九州市小倉北区西港町１５−６５ ラウンドワンスタジアム小倉店
ラウンドワン大野城店,福岡県大野城市御笠川１−１８−１６,"33.546419 130.4822611",https://www.google.com/search?q=33.546419+130.4822611,日本、〒816-0912 福岡県大野城市御笠川１丁目１８−１６
ラウンドワン佐賀店,佐賀県佐賀市兵庫北４−２−１,"33.2751752 130.3011283",https://www.google.com/search?q=33.2751752+130.3011283,日本、〒849-0919 佐賀県佐賀市兵庫北４丁目２−１ ラウンドワンスタジアム佐賀店
G-stage浜町,長崎県長崎市浜町2-26,"32.7448426 129.8775591",https://www.google.com/search?q=32.7448426+129.8775591,日本、〒850-0853 長崎県長崎市浜町２−２６ 津田興産ビル
リッチモンド,熊本県八代市旭中央通２０−３,"32.5041258 130.6076687",https://www.google.com/search?q=32.5041258+130.6076687,日本、〒866-0844 熊本県八代市旭中央通２０−３
スポラ九品寺,熊本県熊本市中央区九品寺5丁目10-15,"32.79043 130.7149856",https://www.google.com/search?q=32.79043+130.7149856,日本、〒862-0976 熊本県熊本市中央区九品寺５丁目１０−１５ スポラ九品寺
ラウンドワン熊本店,熊本県熊本市西区春日7-25-15,"32.7850734 130.6775968",https://www.google.com/search?q=32.7850734+130.6775968,日本、〒860-0047 熊本県熊本市西区春日７丁目２５−１５
ラウンドワン宮崎店,宮崎県宮崎市中村東３−４−６０,"31.8954001 131.4177066",https://www.google.com/search?q=31.8954001+131.4177066,日本、〒880-0904 宮崎県宮崎市中村東３丁目４−６０
タイトーＦステーションニシムタ出水店,鹿児島県出水市六月田町３４７番地,"32.1061403 130.3449862",https://www.google.com/search?q=32.1061403+130.3449862,日本、〒899-0126 鹿児島県出水市六月田町３４７
ラウンドワン鹿児島宇宿店,鹿児島県鹿児島市宇宿2-2-2,"31.544651 130.5434692",https://www.google.com/search?q=31.544651+130.5434692,日本、〒890-0073 鹿児島県鹿児島市宇宿２丁目２−２ 2番2号
