shop,address,count,shopid,shop+address
タイトーFステーション静岡店,静岡県静岡市葵区呉服町二丁目５番地４ ふしみや第２ビル,2,shop_id=8967,タイトーFステーション静岡店 静岡県静岡市葵区呉服町二丁目５番地４ ふしみや第２ビル
ラウンドワン静岡・駿河,静岡県静岡市駿河区向手越一丁目10番1号 ,2,shop_id=10636,ラウンドワン静岡・駿河 静岡県静岡市駿河区向手越一丁目10番1号 
GiGO サントムーン柿田川,静岡県駿東郡清水町玉川 61-2 サントムーン柿田川2F,2,shop_id=1450,GiGO サントムーン柿田川 静岡県駿東郡清水町玉川 61-2 サントムーン柿田川2F
GiGO尾西,愛知県一宮市篭屋3-9-7 アソビックスびさい1階,2,shop_id=3764,GiGO尾西 愛知県一宮市篭屋3-9-7 アソビックスびさい1階
GiGOイオンタウン刈谷,愛知県刈谷市東境町京和1 イオンタウン刈谷,2,shop_id=2881,GiGOイオンタウン刈谷 愛知県刈谷市東境町京和1 イオンタウン刈谷
M'sPARK刈谷,愛知県刈谷市稲場町3-206 ,2,shop_id=11705,M'sPARK刈谷 愛知県刈谷市稲場町3-206 
アミューズメントプラザマルシン,愛知県刈谷市池田町4-609 ,2,shop_id=11686,アミューズメントプラザマルシン 愛知県刈谷市池田町4-609 
ラウンドワンスタジアム名古屋西春,愛知県北名古屋市宇福寺神明15 ,2,shop_id=11664,ラウンドワンスタジアム名古屋西春 愛知県北名古屋市宇福寺神明15 
楽市街道名古屋店,愛知県北名古屋市中之郷字神明４５－１ 楽市街道名古屋,2,shop_id=11009,楽市街道名古屋店 愛知県北名古屋市中之郷字神明４５－１ 楽市街道名古屋
ラウンドワンスタジアム半田店,愛知県半田市瑞穂町6丁目7番地の8 ,4,shop_id=9976,ラウンドワンスタジアム半田店 愛知県半田市瑞穂町6丁目7番地の8 
半田メトロポリス,愛知県半田市旭町3-11-1 半田コロナワールド,4,shop_id=2096,半田メトロポリス 愛知県半田市旭町3-11-1 半田コロナワールド
GiGOマーケットスクエアささしま,愛知県名古屋市中村区平池町4丁目60番地14号 ,2,shop_id=11683,GiGOマーケットスクエアささしま 愛知県名古屋市中村区平池町4丁目60番地14号 
GiGO金山,愛知県名古屋市熱田区金山1-19-2 ,2,shop_id=11680,GiGO金山 愛知県名古屋市熱田区金山1-19-2 
VAMP中川,愛知県名古屋市中川区新家１丁目２００７ ,6,shop_id=11609,VAMP中川 愛知県名古屋市中川区新家１丁目２００７ 
ゲーム・キング・ジョイ,愛知県名古屋市中区栄3-3-32 ,4,shop_id=11724,ゲーム・キング・ジョイ 愛知県名古屋市中区栄3-3-32 
コムテックスクウェア,愛知県名古屋市中区金山1-16-8 ,2,shop_id=11729,コムテックスクウェア 愛知県名古屋市中区金山1-16-8 
コムテックタワー,愛知県名古屋市中村区名駅4-10-20 ,4,shop_id=11728,コムテックタワー 愛知県名古屋市中村区名駅4-10-20 
タイトーステーションフェドラ大須店,愛知県名古屋市中区大須3丁目30番地31号 萬松寺駐車場ビル1階,8,shop_id=3100,タイトーステーションフェドラ大須店 愛知県名古屋市中区大須3丁目30番地31号 萬松寺駐車場ビル1階
タイトーステーション大須店,愛知県名古屋市中区大須3-20-7 タイトーステーション大須,4,shop_id=8054,タイトーステーション大須店 愛知県名古屋市中区大須3-20-7 タイトーステーション大須
ファンタジープラザ名古屋店,愛知県名古屋市北区玄馬町２３４－１ ドン・キホーテ名古屋本店２Ｆ,6,shop_id=9325,ファンタジープラザ名古屋店 愛知県名古屋市北区玄馬町２３４－１ ドン・キホーテ名古屋本店２Ｆ
プラサカプコン徳重店,愛知県名古屋市緑区元徳重1-505 ヒルズウォーク徳重ガーデンズ,2,shop_id=9951,プラサカプコン徳重店 愛知県名古屋市緑区元徳重1-505 ヒルズウォーク徳重ガーデンズ
ポート24八事店,愛知県名古屋市昭和区広路町北石坂102-4 ,2,shop_id=9792,ポート24八事店 愛知県名古屋市昭和区広路町北石坂102-4 
モーリーファンタジー・f 新瑞橋店,愛知県名古屋市南区菊住１丁目７－１０ イオン新瑞橋３階,2,shop_id=2772,モーリーファンタジー・f 新瑞橋店 愛知県名古屋市南区菊住１丁目７－１０ イオン新瑞橋３階
ラウンドワンスタジアム中川1号線,愛知県名古屋市中川区法蔵町2-23 ,4,shop_id=11629,ラウンドワンスタジアム中川1号線 愛知県名古屋市中川区法蔵町2-23 
ラウンドワン千種,愛知県名古屋市千種区新栄3-20-17 タイホウ千種駅南ビル8F,2,shop_id=11655,ラウンドワン千種 愛知県名古屋市千種区新栄3-20-17 タイホウ千種駅南ビル8F
ラウンドワン鳴海,愛知県名古屋市緑区鳴海町字杜若28 ,2,shop_id=11662,ラウンドワン鳴海 愛知県名古屋市緑区鳴海町字杜若28 
名古屋レジャーランド内田橋,愛知県名古屋市南区２－２６－２２ トスカビル ２Ｆ,4,shop_id=8491,名古屋レジャーランド内田橋 愛知県名古屋市南区２－２６－２２ トスカビル ２Ｆ
名古屋レジャーランド大高店,愛知県名古屋市緑区大高町忠治山201番地 ,8,shop_id=1048,名古屋レジャーランド大高店 愛知県名古屋市緑区大高町忠治山201番地 
GiGO安城,愛知県安城市百石町2-35-13 GiGO安城,4,shop_id=8595,GiGO安城 愛知県安城市百石町2-35-13 GiGO安城
安城メトロポリス,愛知県安城市浜富町6-8 安城メトロポリス,2,shop_id=278,安城メトロポリス 愛知県安城市浜富町6-8 安城メトロポリス
小牧メトロポリス,愛知県小牧市間々片山181-1 タイムトラベル館,4,shop_id=2081,小牧メトロポリス 愛知県小牧市間々片山181-1 タイムトラベル館
ADXマミー岡崎,愛知県岡崎市井田新町6-1 ,2,shop_id=11704,ADXマミー岡崎 愛知県岡崎市井田新町6-1 
GiGO岡崎,愛知県岡崎市上地3-50-4 セガ岡崎,4,shop_id=7832,GiGO岡崎 愛知県岡崎市上地3-50-4 セガ岡崎
ゲームファンタジアン岡崎店,愛知県岡崎市錦町２番地４ ＬＯＯＰ岡崎,4,shop_id=8494,ゲームファンタジアン岡崎店 愛知県岡崎市錦町２番地４ ＬＯＯＰ岡崎
ゲームランド岡崎店,愛知県岡崎市戸崎町外山38-5 イオンモール岡崎,4,shop_id=11358,ゲームランド岡崎店 愛知県岡崎市戸崎町外山38-5 イオンモール岡崎
アミューズファクトリー常滑店,愛知県常滑市りんくう町2丁目20番3 イオンモール常滑2階,2,shop_id=9311,アミューズファクトリー常滑店 愛知県常滑市りんくう町2丁目20番3 イオンモール常滑2階
タイトーステーション弥富,愛知県弥富市五明蒲原1371-4 タイトーステーション弥富,2,shop_id=3335,タイトーステーション弥富 愛知県弥富市五明蒲原1371-4 タイトーステーション弥富
GiGO春日井,愛知県春日井市岩野町菅廻間4180 GiGO春日井,4,shop_id=5723,GiGO春日井 愛知県春日井市岩野町菅廻間4180 GiGO春日井
オークランドボウル春日井,愛知県春日井市鳥居松町3-11 1Fゲームコーナー,4,shop_id=11727,オークランドボウル春日井 愛知県春日井市鳥居松町3-11 1Fゲームコーナー
ラウンドワンスタジアムイーアス春日井,愛知県春日井市六軒屋町東丘22 iias春日井　3010区画,2,shop_id=11675,ラウンドワンスタジアムイーアス春日井 愛知県春日井市六軒屋町東丘22 iias春日井　3010区画
アミューズメントプラザワイド,愛知県東海市名和町二番割上16-2 ,2,shop_id=11687,アミューズメントプラザワイド 愛知県東海市名和町二番割上16-2 
アミュージアム津島店,愛知県津島市大字津島字北新開351 ヨシズヤ津島本店 シネマ館2F,2,shop_id=1371,アミュージアム津島店 愛知県津島市大字津島字北新開351 ヨシズヤ津島本店 シネマ館2F
ゲームアルカナ,愛知県稲沢市朝府町2-33 ,4,shop_id=11726,ゲームアルカナ 愛知県稲沢市朝府町2-33 
プラサカプコン稲沢店,愛知県稲沢市長野7丁目1-2 リーフウォーク稲沢2階,2,shop_id=5650,プラサカプコン稲沢店 愛知県稲沢市長野7丁目1-2 リーフウォーク稲沢2階
MIRAINOイオンモール豊川,愛知県豊川市白鳥町兎足1-16 イオンモール豊川3F ,4,shop_id=12318,MIRAINOイオンモール豊川 愛知県豊川市白鳥町兎足1-16 イオンモール豊川3F 
豊川メトロポリス,愛知県豊川市下長山町上アライ１４－１ 豊川コロナワールド,6,shop_id=2517,豊川メトロポリス 愛知県豊川市下長山町上アライ１４－１ 豊川コロナワールド
GiGO豊橋飯村,愛知県豊橋市飯村町西山25-121 GiGO豊橋飯村,4,shop_id=8716,GiGO豊橋飯村 愛知県豊橋市飯村町西山25-121 GiGO豊橋飯村
アピナ豊橋店,愛知県豊橋市藤沢町141 メガ・ドン・キホーテ豊橋店アミューズメント1階,2,shop_id=11566,アピナ豊橋店 愛知県豊橋市藤沢町141 メガ・ドン・キホーテ豊橋店アミューズメント1階
モーリーファンタジー豊橋南店,愛知県豊橋市野依町字落合１－１２ イオン豊橋南２階,2,shop_id=2252,モーリーファンタジー豊橋南店 愛知県豊橋市野依町字落合１－１２ イオン豊橋南２階
ラウンドワンスタジアム豊橋,愛知県豊橋市大岩町字岩田27番地-2 ,4,shop_id=10747,ラウンドワンスタジアム豊橋 愛知県豊橋市大岩町字岩田27番地-2 
GiGO豊田,愛知県豊田市深田町1-65-1 GiGO豊田,4,shop_id=3627,GiGO豊田 愛知県豊田市深田町1-65-1 GiGO豊田
MsPARK豊田店,愛知県豊田市寿町３－１０ ,4,shop_id=5752,MsPARK豊田店 愛知県豊田市寿町３－１０ 
ゲームファンタジアン長久手,愛知県長久手市武蔵塚705 ,4,shop_id=9822,ゲームファンタジアン長久手 愛知県長久手市武蔵塚705 
ユーズランド東浦店,愛知県知多郡東浦町大字緒川字旭13-2 イオンモール東浦2階,4,shop_id=5541,ユーズランド東浦店 愛知県知多郡東浦町大字緒川字旭13-2 イオンモール東浦2階
ポート24幸田店,愛知県額田郡幸田町大字相見字沖原1-3 カメリアガーデン幸田,4,shop_id=6798,ポート24幸田店 愛知県額田郡幸田町大字相見字沖原1-3 カメリアガーデン幸田
PALO津南店,三重県三重県津市高茶屋小森町145 イオンモール津南3階,2,shop_id=11591,PALO津南店 三重県三重県津市高茶屋小森町145 イオンモール津南3階
GiGO伊勢,三重県伊勢市中須町666 AGスクエア伊勢,2,shop_id=6288,GiGO伊勢 三重県伊勢市中須町666 AGスクエア伊勢
GiGO生桑,三重県四日市市生桑町字川原崎299-1 GiGO生桑,2,shop_id=5915,GiGO生桑 三重県四日市市生桑町字川原崎299-1 GiGO生桑
アピナ四日市店,三重県四日市市泊小柳町4-34 ,4,shop_id=11339,アピナ四日市店 三重県四日市市泊小柳町4-34 
プレビトナリエ四日市店,三重県四日市市安島1-3-31 トナリエ5階,2,shop_id=13,プレビトナリエ四日市店 三重県四日市市安島1-3-31 トナリエ5階
GiGO桑名,三重県桑名市大字大仲新田字宮前158番地 サンシパーク,2,shop_id=7884,GiGO桑名 三重県桑名市大字大仲新田字宮前158番地 サンシパーク
PALO桑名店,三重県桑名市新西方1丁目22番地 イオン2F,2,shop_id=10077,PALO桑名店 三重県桑名市新西方1丁目22番地 イオン2F
NICOPAイオン津店,三重県津市桜橋3-446 イオン津2階,2,shop_id=5617,NICOPAイオン津店 三重県津市桜橋3-446 イオン津2階
ラウンドワン津・高茶屋,三重県津市高茶屋小森町277-8 ,4,shop_id=11641,ラウンドワン津・高茶屋 三重県津市高茶屋小森町277-8 
アピナ鈴鹿店,三重県鈴鹿市庄野羽山４－２０－１ イオンタウン鈴鹿２Ｆ,4,shop_id=8592,アピナ鈴鹿店 三重県鈴鹿市庄野羽山４－２０－１ イオンタウン鈴鹿２Ｆ
アミパラ鈴鹿店,三重県鈴鹿市西条町東澤４３０－１ アミパラ鈴鹿,2,shop_id=11003,アミパラ鈴鹿店 三重県鈴鹿市西条町東澤４３０－１ アミパラ鈴鹿
ラウンドワンスタジアムみえ・川越IC,三重県三重郡川越町南福崎851-1 ,4,shop_id=11670,ラウンドワンスタジアムみえ・川越IC 三重県三重郡川越町南福崎851-1 
アクション堅田,滋賀県大津市今堅田２丁目４０－１０ アクション堅田,2,shop_id=5771,アクション堅田 滋賀県大津市今堅田２丁目４０－１０ アクション堅田
ラウンドワン浜大津アーカス,滋賀県大津市浜町２－１ 浜大津アーカス,2,shop_id=8837,ラウンドワン浜大津アーカス 滋賀県大津市浜町２－１ 浜大津アーカス
滋賀レジャーランド大津,滋賀県大津市におの浜3-1-43 ,4,shop_id=11325,滋賀レジャーランド大津 滋賀県大津市におの浜3-1-43 
エースレーン守山,滋賀県守山市播磨田町２３１－４ ＡＣＴ守山３番館２Ｆ,2,shop_id=8247,エースレーン守山 滋賀県守山市播磨田町２３１－４ ＡＣＴ守山３番館２Ｆ
namcoビバシティ彦根,滋賀県彦根市竹ヶ鼻町４３－１ ビバシティ彦根２Ｆ,4,shop_id=1666,namcoビバシティ彦根 滋賀県彦根市竹ヶ鼻町４３－１ ビバシティ彦根２Ｆ
ゲームディーノ彦根,滋賀県彦根市西沼波町166 ,4,shop_id=11847,ゲームディーノ彦根 滋賀県彦根市西沼波町166 
GiGO甲西,滋賀県湖南市夏見二ツ橋356-1 GiGO甲西,2,shop_id=8510,GiGO甲西 滋賀県湖南市夏見二ツ橋356-1 GiGO甲西
GiGOエイスクエア草津,滋賀県草津市西渋川1-23-23 エイスクエア2F,2,shop_id=3085,GiGOエイスクエア草津 滋賀県草津市西渋川1-23-23 エイスクエア2F
アミパラ草津店,滋賀県草津市木川町72 ,2,shop_id=10500,アミパラ草津店 滋賀県草津市木川町72 
ゲームランド草津店,滋賀県草津市新浜町３００番地 イオン草津３階,4,shop_id=1944,ゲームランド草津店 滋賀県草津市新浜町３００番地 イオン草津３階
エースレーン近江八幡,滋賀県近江八幡市 出町736 ,2,shop_id=10449,エースレーン近江八幡 滋賀県近江八幡市 出町736 
タイトーFステーション 近江八幡店,滋賀県近江八幡市鷹飼町南3-7 イオン近江八幡,4,shop_id=7272,タイトーFステーション 近江八幡店 滋賀県近江八幡市鷹飼町南3-7 イオン近江八幡
エースレーン愛知川店,滋賀県愛知郡愛荘町長野200 ,2,shop_id=11115,エースレーン愛知川店 滋賀県愛知郡愛荘町長野200 
GiGO MOMOテラス京都伏見,京都府京都市伏見区桃山町山ノ下32 MOMOテラスAM棟2F,2,shop_id=1385,GiGO MOMOテラス京都伏見 京都府京都市伏見区桃山町山ノ下32 MOMOテラスAM棟2F
namcoイオンモールKYOTO店,京都府京都市南区西九条鳥居口町1 イオンモールKYOTO Sakura館 4F,6,shop_id=5611,namcoイオンモールKYOTO店 京都府京都市南区西九条鳥居口町1 イオンモールKYOTO Sakura館 4F
サープラ京都あそびタウン,京都府京都市中京区西ノ京栂尾町107番地 BiVi二条内2階,4,shop_id=120,サープラ京都あそびタウン 京都府京都市中京区西ノ京栂尾町107番地 BiVi二条内2階
ネオ・アミューズメントスペースa-cho,京都府京都市中京区寺町通四条上る東大文字町３０２－３０３ Ａ－ｂｒｅａｋビル２・３Ｆ,2,shop_id=5960,ネオ・アミューズメントスペースa-cho 京都府京都市中京区寺町通四条上る東大文字町３０２－３０３ Ａ－ｂｒｅａｋビル２・３Ｆ
プラサカプコン京都店,京都府京都市右京区西院追分町２５－１ イオン京都五条３階,2,shop_id=11360,プラサカプコン京都店 京都府京都市右京区西院追分町２５－１ イオン京都五条３階
ラウンドワンスタジアム京都伏見店,京都府京都市伏見区下鳥羽平塚町23 ,4,shop_id=5672,ラウンドワンスタジアム京都伏見店 京都府京都市伏見区下鳥羽平塚町23 
ラウンドワン京都河原町,京都府京都市中京区河原町通三条下る山崎町250 ,6,shop_id=11630,ラウンドワン京都河原町 京都府京都市中京区河原町通三条下る山崎町250 
モーリーファンタジー高の原店,京都府木津川市相楽台１－１－１ イオン高の原４階,2,shop_id=2232,モーリーファンタジー高の原店 京都府木津川市相楽台１－１－１ イオン高の原４階
あそVIVA,京都府福知山市堀小字下高田2346 ,2,shop_id=5773,あそVIVA 京都府福知山市堀小字下高田2346 
アミパラ久御山店,京都府久世郡久御山町森大内337 イオンタウン久御山,2,shop_id=10996,アミパラ久御山店 京都府久世郡久御山町森大内337 イオンタウン久御山
ゲームフェイス八尾店,大阪府八尾市天王寺屋２－６８ 八尾ボールアロー,2,shop_id=3677,ゲームフェイス八尾店 大阪府八尾市天王寺屋２－６８ 八尾ボールアロー
フタバボウル関大前店,大阪府吹田市千里山東１－７－１８ ,4,shop_id=6033,フタバボウル関大前店 大阪府吹田市千里山東１－７－１８ 
GiGO和泉,大阪府和泉市肥子町2-4-41 GiGO和泉,2,shop_id=8055,GiGO和泉 大阪府和泉市肥子町2-4-41 GiGO和泉
アミパラ光明池店,大阪府和泉市室堂町824-36 コムボックス光明池2階,2,shop_id=11570,アミパラ光明池店 大阪府和泉市室堂町824-36 コムボックス光明池2階
ラウンドワンららぽーと和泉店,大阪府和泉市あゆみ野４－４－７ ４階 ららぽーと和泉,2,shop_id=8851,ラウンドワンららぽーと和泉店 大阪府和泉市あゆみ野４－４－７ ４階 ららぽーと和泉
ゲームパニック堺,大阪府堺市堺区築港八幡町1番地1堺浜 シーサイドステージ内堺浜エンタメ館,2,shop_id=3247,ゲームパニック堺 大阪府堺市堺区築港八幡町1番地1堺浜 シーサイドステージ内堺浜エンタメ館
ソユーゲームフィールド堺鉄砲町店,大阪府堺市堺区鉄砲町1番地 イオンモール堺鉄砲町3階,2,shop_id=9382,ソユーゲームフィールド堺鉄砲町店 大阪府堺市堺区鉄砲町1番地 イオンモール堺鉄砲町3階
ラウンドワンスタジアム堺中央環状店,大阪府堺市東区石原町２町２４１番 ラウンドワンスタジアム堺中央環状,2,shop_id=6114,ラウンドワンスタジアム堺中央環状店 大阪府堺市東区石原町２町２４１番 ラウンドワンスタジアム堺中央環状
ラウンドワンスタジアム堺駅前,大阪府堺市堺区戎島町4-44-3 ,2,shop_id=11656,ラウンドワンスタジアム堺駅前 大阪府堺市堺区戎島町4-44-3 
アミパラ大東店,大阪府大東市南新田2丁目3-5 ,2,shop_id=10729,アミパラ大東店 大阪府大東市南新田2丁目3-5 
G-palaあべの,大阪府大阪市阿倍野区阿倍野筋3-10-1 あべのベルタ2F,4,shop_id=11706,G-palaあべの 大阪府大阪市阿倍野区阿倍野筋3-10-1 あべのベルタ2F
GiGO 難波アビオン,大阪府大阪市浪速区難波中2-3-15 MMOビル1F・2F,6,shop_id=11739,GiGO 難波アビオン 大阪府大阪市浪速区難波中2-3-15 MMOビル1F・2F
GiGOあべのアポロ 3F,大阪府大阪市阿倍野区阿倍野筋1-5-31 アポロビル3F,6,shop_id=1791,GiGOあべのアポロ 3F 大阪府大阪市阿倍野区阿倍野筋1-5-31 アポロビル3F
GiGO今福,大阪府大阪市城東区今福東1-9-34 GiGO今福,2,shop_id=5588,GiGO今福 大阪府大阪市城東区今福東1-9-34 GiGO今福
GiGO大阪第4ビル,大阪府大阪市北区梅田1-11-4 駅前第4ビル地下1階,4,shop_id=5618,GiGO大阪第4ビル 大阪府大阪市北区梅田1-11-4 駅前第4ビル地下1階
namcoマグスミノエ店,大阪府大阪市住之江区泉1丁目1番82号 マグスミノエ1F,4,shop_id=1651,namcoマグスミノエ店 大阪府大阪市住之江区泉1丁目1番82号 マグスミノエ1F
namco大阪日本橋店,大阪府大阪市浪速区難波中2-1-17 コスモビル,10,shop_id=5518,namco大阪日本橋店 大阪府大阪市浪速区難波中2-1-17 コスモビル
namco梅田,大阪府大阪市北区小松原町3番3号 OSビル2Fナムコシティ内,10,shop_id=1641,namco梅田 大阪府大阪市北区小松原町3番3号 OSビル2Fナムコシティ内
アテナ日本橋,大阪府大阪市浪速区難波中２－１－２２ ,2,shop_id=5784,アテナ日本橋 大阪府大阪市浪速区難波中２－１－２２ 
アミューズファクトリーAXE,大阪府大阪市中央区難波1-1-3 ,2,shop_id=11695,アミューズファクトリーAXE 大阪府大阪市中央区難波1-1-3 
タイトーステーション大阪日本橋店,大阪府大阪市浪速区日本橋４－９－１４ タイトーステーション大阪日本橋,2,shop_id=4004,タイトーステーション大阪日本橋店 大阪府大阪市浪速区日本橋４－９－１４ タイトーステーション大阪日本橋
タイトーステーション難波,大阪府大阪市中央区難波千日前１５－１２ タイトーステーション難波,2,shop_id=3620,タイトーステーション難波 大阪府大阪市中央区難波千日前１５－１２ タイトーステーション難波
モーリーファンタジーLINKS UMEDA店,大阪府大阪市北区大深町4-8 LINKS UMEDA 5F,2,shop_id=10909,モーリーファンタジーLINKS UMEDA店 大阪府大阪市北区大深町4-8 LINKS UMEDA 5F
ラウンドワンスタジアム千日前店,大阪府大阪市中央区難波1丁目3番1号 ラウンドワン千日前,10,shop_id=6697,ラウンドワンスタジアム千日前店 大阪府大阪市中央区難波1丁目3番1号 ラウンドワン千日前
ラウンドワンスタジアム城東放出,大阪府大阪市城東区今福南3-4-38 ,2,shop_id=11646,ラウンドワンスタジアム城東放出 大阪府大阪市城東区今福南3-4-38 
ラウンドワン梅田,大阪府大阪市北区小松原町4-16 ,6,shop_id=11627,ラウンドワン梅田 大阪府大阪市北区小松原町4-16 
天王寺パスカ店,大阪府大阪市阿倍野区阿倍野筋２－４－５１ 天王寺パスカ,2,shop_id=5715,天王寺パスカ店 大阪府大阪市阿倍野区阿倍野筋２－４－５１ 天王寺パスカ
ゲームプラザエム,大阪府守口市本町1丁目3-3 ,2,shop_id=12353,ゲームプラザエム 大阪府守口市本町1丁目3-3 
ラウンドワン守口店,大阪府守口市佐太東町２－６－１４ ジャガーグリーン２階,2,shop_id=5678,ラウンドワン守口店 大阪府守口市佐太東町２－６－１４ ジャガーグリーン２階
YAZ寝屋川店,大阪府寝屋川市石津中町25-26 YAZ寝屋川,4,shop_id=11340,YAZ寝屋川店 大阪府寝屋川市石津中町25-26 YAZ寝屋川
モンキートリック,大阪府寝屋川市香里南之町32-5 YNレジデンス香里2F,4,shop_id=11730,モンキートリック 大阪府寝屋川市香里南之町32-5 YNレジデンス香里2F
ラウンドワン岸和田,大阪府岸和田市八阪町2-11-1 ,2,shop_id=11667,ラウンドワン岸和田 大阪府岸和田市八阪町2-11-1 
星狩物語岸和田,大阪府岸和田市作才町1-3-2 ,2,shop_id=11721,星狩物語岸和田 大阪府岸和田市作才町1-3-2 
GiGO布施,大阪府東大阪市長堂1-1-1 ロンモール布施内,2,shop_id=3086,GiGO布施 大阪府東大阪市長堂1-1-1 ロンモール布施内
あそびのひろば 鴻池店,大阪府東大阪市鴻池町1‐1‐72 ,2,shop_id=10246,あそびのひろば 鴻池店 大阪府東大阪市鴻池町1‐1‐72 
ラウンドワン東大阪,大阪府東大阪市若江南町1-2-12 ,4,shop_id=11647,ラウンドワン東大阪 大阪府東大阪市若江南町1-2-12 
GiGO枚方,大阪府枚方市須山町83-1 サンシャインプラザ枚方,2,shop_id=3895,GiGO枚方 大阪府枚方市須山町83-1 サンシャインプラザ枚方
ラウンドワンスタジアム枚方店,大阪府枚方市高野道１丁目２０番２０号 フォレオひらかた,2,shop_id=8570,ラウンドワンスタジアム枚方店 大阪府枚方市高野道１丁目２０番２０号 フォレオひらかた
タイトーFステーションりんくうシークル店,大阪府泉佐野市りんくう往来3 りんくうPTシークル,2,shop_id=5853,タイトーFステーションりんくうシークル店 大阪府泉佐野市りんくう往来3 りんくうPTシークル
泉大津フタバボウル,大阪府泉大津市松之浜町１丁目２番５３号 泉大津フタバボウル,2,shop_id=1524,泉大津フタバボウル 大阪府泉大津市松之浜町１丁目２番５３号 泉大津フタバボウル
あそVIVA阪急茨木店,大阪府茨木市永代町6-2 スポーツプラザ茨木2階,4,shop_id=11389,あそVIVA阪急茨木店 大阪府茨木市永代町6-2 スポーツプラザ茨木2階
