shop,address,count,shopid,shop+address
サープラ横浜あそびタウン,神奈川県横浜市都筑区中川中央1-25―1 ノースポート・モール6階,4,shop_id=359,サープラ横浜あそびタウン 神奈川県横浜市都筑区中川中央1-25―1 ノースポート・モール6階
シルクハット伊勢佐木町,神奈川県横浜市中区伊勢佐木町3-96 日活会館3F,4,shop_id=11716,シルクハット伊勢佐木町 神奈川県横浜市中区伊勢佐木町3-96 日活会館3F
タイトーステーション戸塚西口店,神奈川県横浜市戸塚区戸塚町４０２３番地 ,4,shop_id=6612,タイトーステーション戸塚西口店 神奈川県横浜市戸塚区戸塚町４０２３番地 
タイトーステーション横浜西口五番街店,神奈川県横浜市西区南幸１－１２－９ タイトーステーション横浜西口五番街,6,shop_id=6441,タイトーステーション横浜西口五番街店 神奈川県横浜市西区南幸１－１２－９ タイトーステーション横浜西口五番街
ドラマ港北インター店,神奈川県横浜市都筑区東方町321-6 ,4,shop_id=11843,ドラマ港北インター店 神奈川県横浜市都筑区東方町321-6 
プラサカプコン磯子店,神奈川県横浜市磯子区磯子１－１－１ マリコム磯子ショッピングセンター２階,2,shop_id=281,プラサカプコン磯子店 神奈川県横浜市磯子区磯子１－１－１ マリコム磯子ショッピングセンター２階
ラウンドワン横浜駅西口,神奈川県横浜市西区南幸2-8-16 ,6,shop_id=11628,ラウンドワン横浜駅西口 神奈川県横浜市西区南幸2-8-16 
ゲームパラダイスゼロワン,神奈川県横須賀市若松町1-6 ヨコビル3F,4,shop_id=11709,ゲームパラダイスゼロワン 神奈川県横須賀市若松町1-6 ヨコビル3F
シルクハット横須賀中央,神奈川県横須賀市若松町1-5 横須賀プライム2階,4,shop_id=11289,シルクハット横須賀中央 神奈川県横須賀市若松町1-5 横須賀プライム2階
プラサカプコン横須賀店,神奈川県横須賀市若松町２－３０ モアーズシティ４階ゲームコーナー,2,shop_id=1909,プラサカプコン横須賀店 神奈川県横須賀市若松町２－３０ モアーズシティ４階ゲームコーナー
GiGO海老名,神奈川県海老名市中央1-4-31 海老名プラザビル1F,2,shop_id=11682,GiGO海老名 神奈川県海老名市中央1-4-31 海老名プラザビル1F
タイトーステーション海老名ビナウォーク店,神奈川県海老名市中央1ー18-1 ビナウォーク6番館2F,4,shop_id=3581,タイトーステーション海老名ビナウォーク店 神奈川県海老名市中央1ー18-1 ビナウォーク6番館2F
GiGO相模大野,神奈川県相模原市相模大野3-13-2 フレスコビル2F,2,shop_id=7521,GiGO相模大野 神奈川県相模原市相模大野3-13-2 フレスコビル2F
アドアーズ橋本店,神奈川県相模原市緑区橋本3-3-1 SING橋本2階,2,shop_id=2091,アドアーズ橋本店 神奈川県相模原市緑区橋本3-3-1 SING橋本2階
アピナ橋本店,神奈川県相模原市緑区西橋本５－１－１ アピナ橋本１階,2,shop_id=8417,アピナ橋本店 神奈川県相模原市緑区西橋本５－１－１ アピナ橋本１階
エブリデイFUNﾊｳｽこころっこアリオ橋本店,神奈川県相模原市緑区大山町１－２２ アリオ橋本２階（２３５区画）　エブリデイＦＵＮハウス,2,shop_id=2905,エブリデイFUNﾊｳｽこころっこアリオ橋本店 神奈川県相模原市緑区大山町１－２２ アリオ橋本２階（２３５区画）　エブリデイＦＵＮハウス
ムトス相模原店,神奈川県相模原市中央区中央2-1-5ムトス内 ,4,shop_id=10753,ムトス相模原店 神奈川県相模原市中央区中央2-1-5ムトス内 
GiGO センター南,神奈川県神奈川県横浜市都筑区茅ケ崎中央3-25 ,4,shop_id=12227,GiGO センター南 神奈川県神奈川県横浜市都筑区茅ケ崎中央3-25 
アドアーズ藤沢北口,神奈川県藤沢市藤沢460-1 3・4F,2,shop_id=11621,アドアーズ藤沢北口 神奈川県藤沢市藤沢460-1 3・4F
ゲームインファンファン藤沢新館,神奈川県藤沢市鵠沼石上1-3-8 ,2,shop_id=11720,ゲームインファンファン藤沢新館 神奈川県藤沢市鵠沼石上1-3-8 
タイトーステーション藤沢店,神奈川県藤沢市南藤沢21-1 ,4,shop_id=9609,タイトーステーション藤沢店 神奈川県藤沢市南藤沢21-1 
ドラマ藤沢店,神奈川県藤沢市本藤沢５－６－８ ドラマ藤沢,4,shop_id=521,ドラマ藤沢店 神奈川県藤沢市本藤沢５－６－８ ドラマ藤沢
楽市楽座湘南藤沢店,神奈川県藤沢市辻堂新町４－３－５ ＭｒＭＡＸ湘南藤沢ショッピングセンター２階,2,shop_id=5709,楽市楽座湘南藤沢店 神奈川県藤沢市辻堂新町４－３－５ ＭｒＭＡＸ湘南藤沢ショッピングセンター２階
シルクハット 大船,神奈川県鎌倉市大船1-24 大船駅前ビル1階、2階、3階,2,shop_id=8499,シルクハット 大船 神奈川県鎌倉市大船1-24 大船駅前ビル1階、2階、3階
アピナ上越インター店,新潟県上越市下門前１６６１ アピナ上越インター,4,shop_id=9036,アピナ上越インター店 新潟県上越市下門前１６６１ アピナ上越インター
タイトーFステーション上越店,新潟県上越市富岡3524 J-MAXシアター内1F,4,shop_id=8945,タイトーFステーション上越店 新潟県上越市富岡3524 J-MAXシアター内1F
上越レジャーランボウル,新潟県上越市下門前薬島827-2 ,2,shop_id=5905,上越レジャーランボウル 新潟県上越市下門前薬島827-2 
Hapipi Land十日町店,新潟県十日町市丑735-1 ,2,shop_id=10144,Hapipi Land十日町店 新潟県十日町市丑735-1 
namco新潟店,新潟県新潟市中央区南笹口1-1-1 ドン・キホーテ新潟駅南2階,6,shop_id=5573,namco新潟店 新潟県新潟市中央区南笹口1-1-1 ドン・キホーテ新潟駅南2階
カプコサーカス新潟東店,新潟県新潟市東区大形本町３－１－２ イオン新潟東,6,shop_id=11362,カプコサーカス新潟東店 新潟県新潟市東区大形本町３－１－２ イオン新潟東
タイトーFステーションイオン新潟西店,新潟県新潟市西区小新南２－１－１０ イオン新潟西３Ｆ,4,shop_id=6411,タイトーFステーションイオン新潟西店 新潟県新潟市西区小新南２－１－１０ イオン新潟西３Ｆ
メジャーロード白根店,新潟県新潟市南区上下諏訪木論地948-2 メジャーロード白根,4,shop_id=6091,メジャーロード白根店 新潟県新潟市南区上下諏訪木論地948-2 メジャーロード白根
メジャーロード黒埼店,新潟県新潟市西区山田3303 メジャーロード黒埼,4,shop_id=6089,メジャーロード黒埼店 新潟県新潟市西区山田3303 メジャーロード黒埼
モーリーファンタジー・f 新潟南店,新潟県新潟市江南区下早通柳田１丁目１番１号 イオンモール新潟南２階,2,shop_id=4734,モーリーファンタジー・f 新潟南店 新潟県新潟市江南区下早通柳田１丁目１番１号 イオンモール新潟南２階
ラウンドワンスタジアム新潟店,新潟県新潟市中央区美咲町２－１－３８ ラウンドワンスタジアム新潟,2,shop_id=5674,ラウンドワンスタジアム新潟店 新潟県新潟市中央区美咲町２－１－３８ ラウンドワンスタジアム新潟
タイトーFステーション燕三条店,新潟県燕市井土巻３－１５０ イオン県央１階,4,shop_id=6815,タイトーFステーション燕三条店 新潟県燕市井土巻３－１５０ イオン県央１階
VIVAZONE糸魚川店,新潟県糸魚川市寺島3-2-40 ヴィラオレッタ糸魚川2Fゲームセンター,2,shop_id=5863,VIVAZONE糸魚川店 新潟県糸魚川市寺島3-2-40 ヴィラオレッタ糸魚川2Fゲームセンター
メジャーロード24,新潟県見附市今町4丁目20番地568番地1 メジャーロード24,4,shop_id=5662,メジャーロード24 新潟県見附市今町4丁目20番地568番地1 メジャーロード24
アピナ長岡店,新潟県長岡市堺東町２２ アピナ長岡,4,shop_id=1494,アピナ長岡店 新潟県長岡市堺東町２２ アピナ長岡
ゲームセンターテクノポリス,新潟県長岡市要町1-8-50 ,2,shop_id=11134,ゲームセンターテクノポリス 新潟県長岡市要町1-8-50 
アピナ富山南店,富山県富山市堀川町355-3 マイプラザ,4,shop_id=6680,アピナ富山南店 富山県富山市堀川町355-3 マイプラザ
アピナ富山新庄店,富山県富山市荒川３－２－１２ アピナ富山新庄,2,shop_id=496,アピナ富山新庄店 富山県富山市荒川３－２－１２ アピナ富山新庄
アピナ富山豊田店,富山県富山市豊田町２－１２－６６ アピナ富山豊田,2,shop_id=11353,アピナ富山豊田店 富山県富山市豊田町２－１２－６６ アピナ富山豊田
タイトーステーションファボーレ婦中店,富山県富山市婦中町下轡田１６５－１ フューチャーシティファボーレ２階,2,shop_id=3586,タイトーステーションファボーレ婦中店 富山県富山市婦中町下轡田１６５－１ フューチャーシティファボーレ２階
トヤマレジャーランド呉羽店,富山県富山市高木2054 ,4,shop_id=1987,トヤマレジャーランド呉羽店 富山県富山市高木2054 
富山レジャーランド射水店,富山県射水市小島3724-1 大阪屋ショップアプリオ2階,2,shop_id=11816,富山レジャーランド射水店 富山県射水市小島3724-1 大阪屋ショップアプリオ2階
モーリーファンタジーとなみ店,富山県砺波市中神一丁目174番地 イオンモールとなみ2階,2,shop_id=10252,モーリーファンタジーとなみ店 富山県砺波市中神一丁目174番地 イオンモールとなみ2階
ゲームスポット207,富山県高岡市鐘紡町１６５５－３ ゲームスポット２０７,2,shop_id=8880,ゲームスポット207 富山県高岡市鐘紡町１６５５－３ ゲームスポット２０７
サービスエリアイン高岡,富山県高岡市下石瀬857-1 ,2,shop_id=11723,サービスエリアイン高岡 富山県高岡市下石瀬857-1 
ユーズランド高岡店,富山県高岡市下伏間江３８３ イオン高岡南２階,4,shop_id=5666,ユーズランド高岡店 富山県高岡市下伏間江３８３ イオン高岡南２階
ゲームセンターベティ,石川県七尾市舟尾町ウ-38 ,2,shop_id=11791,ゲームセンターベティ 石川県七尾市舟尾町ウ-38 
バイパスレジャーランド加賀店,石川県加賀市箱宮町ヲ1-1 ,2,shop_id=430,バイパスレジャーランド加賀店 石川県加賀市箱宮町ヲ1-1 
MIRAINOイオンモール白山店,石川県白山市横江町土地区画整理事業施工地区内1街区 イオンモール白山3階3014区画,2,shop_id=11382,MIRAINOイオンモール白山店 石川県白山市横江町土地区画整理事業施工地区内1街区 イオンモール白山3階3014区画
アピナ野々市店,石川県野々市市白山町４－１ イオンタウン野々市,2,shop_id=9690,アピナ野々市店 石川県野々市市白山町４－１ イオンタウン野々市
GiGOイオンタウン金沢示野,石川県金沢市示野中町87街区2号 イオンタウン金沢示野,2,shop_id=7313,GiGOイオンタウン金沢示野 石川県金沢市示野中町87街区2号 イオンタウン金沢示野
ゲーム・パラダイス,石川県金沢市堀川新町5-1 アミューズメントスクエア3F,2,shop_id=11678,ゲーム・パラダイス 石川県金沢市堀川新町5-1 アミューズメントスクエア3F
タイトーステーション金沢,石川県金沢市片町2-1-7 宇都宮片町ビル1F,2,shop_id=11595,タイトーステーション金沢 石川県金沢市片町2-1-7 宇都宮片町ビル1F
バイパスレジャーランド藤江新館,石川県金沢市藤江南2ー105 ,8,shop_id=484,バイパスレジャーランド藤江新館 石川県金沢市藤江南2ー105 
バイパスレジャーランド藤江本館,石川県金沢市藤江南2-41 ,4,shop_id=12252,バイパスレジャーランド藤江本館 石川県金沢市藤江南2-41 
ラウンドワンスタジアム金沢店,石川県金沢市横川６－１２０－１ ,2,shop_id=6112,ラウンドワンスタジアム金沢店 石川県金沢市横川６－１２０－１ 
ジョイランド敦賀店,福井県敦賀市木崎40-12 ,2,shop_id=5904,ジョイランド敦賀店 福井県敦賀市木崎40-12 
GiGO福井,福井県福井市丸山1-410 ,2,shop_id=12327,GiGO福井 福井県福井市丸山1-410 
レッツワクワク エルパ店,福井県福井市大和田町第32-24-1 エルパ,2,shop_id=3850,レッツワクワク エルパ店 福井県福井市大和田町第32-24-1 エルパ
福井レジャーランドワイプラザ店,福井県福井市新保町北1ー303 ヤスサキワイプラザB棟2階,4,shop_id=2060,福井レジャーランドワイプラザ店 福井県福井市新保町北1ー303 ヤスサキワイプラザB棟2階
福井レジャーランド板垣店,福井県福井市下馬3-101 ,4,shop_id=10106,福井レジャーランド板垣店 福井県福井市下馬3-101 
GiGO武生,福井県越前市新町3字13-4 GiGO武生,2,shop_id=1796,GiGO武生 福井県越前市新町3字13-4 GiGO武生
プレイタウン・パル富士吉田店,山梨県富士吉田市新西原4丁目12-15 ,2,shop_id=12287,プレイタウン・パル富士吉田店 山梨県富士吉田市新西原4丁目12-15 
ゲームパニック甲府店,山梨県甲府市国母5-20-24 ゲームパニック甲府,2,shop_id=9915,ゲームパニック甲府店 山梨県甲府市国母5-20-24 ゲームパニック甲府
ﾀｲﾄｰFｽﾃｰｼｮﾝﾗｻﾞｳｫｰｸ甲斐双葉店,山梨県甲斐市志田字柿木６１６－１ ラザウォーク甲斐双葉アミューズメント棟１Ｆ,6,shop_id=2489,ﾀｲﾄｰFｽﾃｰｼｮﾝﾗｻﾞｳｫｰｸ甲斐双葉店 山梨県甲斐市志田字柿木６１６－１ ラザウォーク甲斐双葉アミューズメント棟１Ｆ
ラウンドワン山梨・石和,山梨県笛吹市石和町広瀬737-1 ,2,shop_id=11653,ラウンドワン山梨・石和 山梨県笛吹市石和町広瀬737-1 
プラサカプコン甲府店,山梨県中巨摩郡昭和町西条字北河原3717 プラサカプコン甲府,4,shop_id=6037,プラサカプコン甲府店 山梨県中巨摩郡昭和町西条字北河原3717 プラサカプコン甲府
GiGO上田,長野県上田市大字上田1847-1 ,2,shop_id=3281,GiGO上田 長野県上田市大字上田1847-1 
アピナ上田,長野県上田市秋和３５９－１ アピナ上田,4,shop_id=8883,アピナ上田 長野県上田市秋和３５９－１ アピナ上田
アピナ伊那店,長野県伊那市西町５０９３ アピナ伊那,2,shop_id=2298,アピナ伊那店 長野県伊那市西町５０９３ アピナ伊那
アピナ佐久インター店,長野県佐久市岩村田北１－１３－１ アピナ佐久インター,4,shop_id=3883,アピナ佐久インター店 長野県佐久市岩村田北１－１３－１ アピナ佐久インター
アピナ塩尻店,長野県塩尻市広丘野村１７９４－１ アピナ塩尻,4,shop_id=1226,アピナ塩尻店 長野県塩尻市広丘野村１７９４－１ アピナ塩尻
セガワールド豊科,長野県安曇野市豊科南穂高１１１５ セガワールド豊科,2,shop_id=3661,セガワールド豊科 長野県安曇野市豊科南穂高１１１５ セガワールド豊科
GiGO岡谷,長野県岡谷市塚間町2-1-21 セガ岡谷,2,shop_id=218,GiGO岡谷 長野県岡谷市塚間町2-1-21 セガ岡谷
GiGO松本,長野県松本市渚1-7-1  なぎさライフサイト内,4,shop_id=22,GiGO松本 長野県松本市渚1-7-1  なぎさライフサイト内
アピナ松本店,長野県松本市双葉１９－１０ アピナ松本,4,shop_id=9032,アピナ松本店 長野県松本市双葉１９－１０ アピナ松本
PALO諏訪店,長野県諏訪市沖田町5丁目18 諏訪ステーションパーク,4,shop_id=9545,PALO諏訪店 長野県諏訪市沖田町5丁目18 諏訪ステーションパーク
アピナ長野大橋店,長野県長野市若里７－９－１２ アピナ長野大橋,2,shop_id=8504,アピナ長野大橋店 長野県長野市若里７－９－１２ アピナ長野大橋
アピナ長野川中島店,長野県長野市川中島町御厨967-1 アピナ川中島,4,shop_id=3933,アピナ長野川中島店 長野県長野市川中島町御厨967-1 アピナ川中島
アピナ長野村山店,長野県長野市村山５０２－１ アピナ長野村山,2,shop_id=1447,アピナ長野村山店 長野県長野市村山５０２－１ アピナ長野村山
ザ・サードプラネット 長野大通り店,長野県長野市権堂町１５０６番地３ 長電権堂第２ビル１階,2,shop_id=11320,ザ・サードプラネット 長野大通り店 長野県長野市権堂町１５０６番地３ 長電権堂第２ビル１階
ラウンドワンスタジアム長野店,長野県長野市東和田８２７番６ ,2,shop_id=5675,ラウンドワンスタジアム長野店 長野県長野市東和田８２７番６ 
アピナ飯田店,長野県飯田市座光寺３７２７－１ アピナ飯田,2,shop_id=5794,アピナ飯田店 長野県飯田市座光寺３７２７－１ アピナ飯田
オリエンタルバッティングセンター可児,岐阜県可児市?今渡?695-1 ,2,shop_id=12190,オリエンタルバッティングセンター可児 岐阜県可児市?今渡?695-1 
アピナ各務原店,岐阜県各務原市蘇原花園町2-9-1 ,4,shop_id=11196,アピナ各務原店 岐阜県各務原市蘇原花園町2-9-1 
ゲームピコ鵜沼店,岐阜県各務原市鵜沼西町 3丁目309イオンタウン各務原鵜沼内,4,shop_id=12356,ゲームピコ鵜沼店 岐阜県各務原市鵜沼西町 3丁目309イオンタウン各務原鵜沼内
MIRAINOイオンモール土岐店,岐阜県土岐市土岐津町土岐口 1372番1イオンモール土岐2F,2,shop_id=11992,MIRAINOイオンモール土岐店 岐阜県土岐市土岐津町土岐口 1372番1イオンモール土岐2F
ゲームハウスアリババ,岐阜県大垣市池尻町940-1 ,4,shop_id=9830,ゲームハウスアリババ 岐阜県大垣市池尻町940-1 
大垣メトロポリス,岐阜県大垣市三塚町西沼５２３－１ イオンタウン大垣,2,shop_id=2312,大垣メトロポリス 岐阜県大垣市三塚町西沼５２３－１ イオンタウン大垣
ACグランド茜部店,岐阜県岐阜市茜部大川１－７７ ,4,shop_id=9084,ACグランド茜部店 岐阜県岐阜市茜部大川１－７７ 
ゲームファンタジアン 精華店,岐阜県岐阜市鏡島精華2-2-1 ,2,shop_id=11770,ゲームファンタジアン 精華店 岐阜県岐阜市鏡島精華2-2-1 
モーリーファンタジー・f 岐阜店,岐阜県岐阜市正木中1-2-1 イオン岐阜北館 イオン3F,2,shop_id=9556,モーリーファンタジー・f 岐阜店 岐阜県岐阜市正木中1-2-1 イオン岐阜北館 イオン3F
アピナ本巣店,岐阜県本巣市政田字下西浦 1986 イオンタウン本巣内,2,shop_id=11331,アピナ本巣店 岐阜県本巣市政田字下西浦 1986 イオンタウン本巣内
ラウンドワンモレラ岐阜店,岐阜県本巣市三橋１１００ モレラ岐阜,2,shop_id=5676,ラウンドワンモレラ岐阜店 岐阜県本巣市三橋１１００ モレラ岐阜
岐阜レジャーランド穂積店,岐阜県瑞穂市稲里630番地 ,4,shop_id=984,岐阜レジャーランド穂積店 岐阜県瑞穂市稲里630番地 
セガワールド高山,岐阜県高山市上岡本町７丁目７ ,2,shop_id=12350,セガワールド高山 岐阜県高山市上岡本町７丁目７ 
ジョイランド三島,静岡県三島市梅名３０８－６ ,2,shop_id=2523,ジョイランド三島 静岡県三島市梅名３０８－６ 
タイトーＦステーションイオン富士宮店,静岡県富士宮市浅間町１番８号 イオン富士宮３階,2,shop_id=6420,タイトーＦステーションイオン富士宮店 静岡県富士宮市浅間町１番８号 イオン富士宮３階
モーリーファンタジー富士宮店,静岡県富士宮市浅間町1-8 イオン富士宮2階,2,shop_id=9550,モーリーファンタジー富士宮店 静岡県富士宮市浅間町1-8 イオン富士宮2階
ザ・サードプラネット富士店,静岡県富士市永田町２－９９ ザ・サードプラネット富士,2,shop_id=555,ザ・サードプラネット富士店 静岡県富士市永田町２－９９ ザ・サードプラネット富士
モーリーファンタジー・f 富士南店,静岡県富士市鮫島１１８－１０ イオンタウン富士南２階,2,shop_id=2768,モーリーファンタジー・f 富士南店 静岡県富士市鮫島１１８－１０ イオンタウン富士南２階
ラウンドワン富士,静岡県富士市八代町4番15号 ,4,shop_id=10746,ラウンドワン富士 静岡県富士市八代町4番15号 
THE 3RD PLANET島田店,静岡県島田市中溝町2531 THE3RDPLANET島田,2,shop_id=1139,THE 3RD PLANET島田店 静岡県島田市中溝町2531 THE3RDPLANET島田
アップル島田,静岡県島田市宝来町8-5 アップル島田,2,shop_id=8256,アップル島田 静岡県島田市宝来町8-5 アップル島田
GiGO掛川,静岡県掛川市細田248 GiGO掛川,4,shop_id=8357,GiGO掛川 静岡県掛川市細田248 GiGO掛川
アピナ大須賀店,静岡県掛川市西大渕3359 ロックタウン,2,shop_id=11200,アピナ大須賀店 静岡県掛川市西大渕3359 ロックタウン
ザ・サードプラネットＢｉＶｉ沼津店,静岡県沼津市大手町１－１－５ ＢｉＶｉ沼津,4,shop_id=3000,ザ・サードプラネットＢｉＶｉ沼津店 静岡県沼津市大手町１－１－５ ＢｉＶｉ沼津
ジョイランドアミューズ諏訪店,静岡県沼津市大諏訪叶２０－２ ジョイランドアミューズ諏訪,2,shop_id=3899,ジョイランドアミューズ諏訪店 静岡県沼津市大諏訪叶２０－２ ジョイランドアミューズ諏訪
アピナ浜松店,静岡県浜松市中区葵西2-27-10 イオンタウン内,2,shop_id=11337,アピナ浜松店 静岡県浜松市中区葵西2-27-10 イオンタウン内
ザ・サードプラネット OZ浜松店,静岡県浜松市東区宮竹町３２２－１ ＯＺ浜松,4,shop_id=7305,ザ・サードプラネット OZ浜松店 静岡県浜松市東区宮竹町３２２－１ ＯＺ浜松
タイトーFステーションイオンモール浜松市野店,静岡県浜松市東区天王町１９８１－３ イオンモール浜松市野２Ｆ,2,shop_id=8731,タイトーFステーションイオンモール浜松市野店 静岡県浜松市東区天王町１９８１－３ イオンモール浜松市野２Ｆ
プラサカプコン志都呂店,静岡県浜松市西区志都呂町2丁目37-1 イオンモール浜松志都呂3階,2,shop_id=1925,プラサカプコン志都呂店 静岡県浜松市西区志都呂町2丁目37-1 イオンモール浜松志都呂3階
ポート24浜松店,静岡県浜松市西区坪井町４１８３ ポート２４浜松,4,shop_id=8441,ポート24浜松店 静岡県浜松市西区坪井町４１８３ ポート２４浜松
ラウンドワンスタジアム浜松,静岡県浜松市東区天王町字諏訪1981-17 ,4,shop_id=11633,ラウンドワンスタジアム浜松 静岡県浜松市東区天王町字諏訪1981-17 
楽市楽座サンストリート浜北店,静岡県浜松市浜北区平口２８６１ サンストリート浜北Ｍ－２０７,2,shop_id=1153,楽市楽座サンストリート浜北店 静岡県浜松市浜北区平口２８６１ サンストリート浜北Ｍ－２０７
アップルグランリバー大井川店,静岡県焼津市下江留1327番地 アップルグランリバー大井川,2,shop_id=3840,アップルグランリバー大井川店 静岡県焼津市下江留1327番地 アップルグランリバー大井川
アピナ焼津店,静岡県焼津市道原585 シートピアYAZ焼津,4,shop_id=11199,アピナ焼津店 静岡県焼津市道原585 シートピアYAZ焼津
ザ・サードプラネット焼津,静岡県焼津市八楠３－１８－５ ザ・サードプラネット焼津,4,shop_id=1182,ザ・サードプラネット焼津 静岡県焼津市八楠３－１８－５ ザ・サードプラネット焼津
アピナ磐田店,静岡県磐田市西貝塚横須賀道北3690イオンタウン磐田内 ,2,shop_id=9413,アピナ磐田店 静岡県磐田市西貝塚横須賀道北3690イオンタウン磐田内 
GiGO袋井,静岡県袋井市川井1142-1 GiGO袋井,2,shop_id=8717,GiGO袋井 静岡県袋井市川井1142-1 GiGO袋井
AMUSEMENT PARK(静岡店),静岡県静岡市葵区柚木191 MARKIS静岡3階,2,shop_id=7550,AMUSEMENT PARK(静岡店) 静岡県静岡市葵区柚木191 MARKIS静岡3階
アップル新北街道店,静岡県静岡市葵区沓谷5-13-4 ,4,shop_id=11781,アップル新北街道店 静岡県静岡市葵区沓谷5-13-4 
スーパーウェーブ静岡店,静岡県静岡市清水区鳥坂860 フレスポ静岡2F西,4,shop_id=11817,スーパーウェーブ静岡店 静岡県静岡市清水区鳥坂860 フレスポ静岡2F西
