"タイトーステーション町田店","東京都町田市原町田6-21-23松山ビル1F","タイトーステーション町田店 東京都町田市原町田6-21-23松山ビル1F"
"タイトーステーション盛岡マッハランド店","岩手県盛岡市上堂1-2-38タイトーステーション盛岡マッハランド","タイトーステーション盛岡マッハランド店 岩手県盛岡市上堂1-2-38タイトーステーション盛岡マッハランド"
"タイトーステーション福岡天神店","福岡県福岡市中央区天神2ー6ー35サザンクロスビル","タイトーステーション福岡天神店 福岡県福岡市中央区天神2ー6ー35サザンクロスビル"
"タイトーステーション秋葉原店","東京都千代田区外神田4-2-2貴三ビル","タイトーステーション秋葉原店 東京都千代田区外神田4-2-2貴三ビル"
"タイトーステーション藤沢店","神奈川県藤沢市南藤沢21-1","タイトーステーション藤沢店 神奈川県藤沢市南藤沢21-1"
"タイトーステーション衣山店","愛媛県松山市衣山1丁目188パルティフジ衣山","タイトーステーション衣山店 愛媛県松山市衣山1丁目188パルティフジ衣山"
"タイトーステーション金沢","石川県金沢市片町2-1-7宇都宮片町ビル1F","タイトーステーション金沢 石川県金沢市片町2-1-7宇都宮片町ビル1F"
"タイトーステーション錦糸町楽天地店","東京都墨田区江東橋4-27-14楽天地ビル1階","タイトーステーション錦糸町楽天地店 東京都墨田区江東橋4-27-14楽天地ビル1階"
"タイトーステーション難波","大阪府大阪市中央区難波千日前15-12タイトーステーション難波","タイトーステーション難波 大阪府大阪市中央区難波千日前15-12タイトーステーション難波"
"タイトーステーション青森アムゼ店","青森県青森市緑3-9-2イオン青森","タイトーステーション青森アムゼ店 青森県青森市緑3-9-2イオン青森"
"ダイナソアエイジ","大阪府大府市東新町3-88","ダイナソアエイジ 大阪府大府市東新町3-88"
"チャットタウン北上店","岩手県北上市鬼柳町19-71番地外江釣子パルショッピングセンター","チャットタウン北上店 岩手県北上市鬼柳町19-71番地外江釣子パルショッピングセンター"
"チャレンジャーガムガム","大阪府吹田市岸部南1-24-9","チャレンジャーガムガム 大阪府吹田市岸部南1-24-9"
"テクモピア船橋南口","千葉県船橋市本町1-7-6 ドリーム船橋3F","テクモピア船橋南口 千葉県船橋市本町1-7-6 ドリーム船橋3F"
"ディノスパーク北見","北海道北見市西三輪5―1―16ディノスパーク北見","ディノスパーク北見 北海道北見市西三輪5―1―16ディノスパーク北見"
"ディノスパーク帯広","北海道帯広市白樺16条西2丁目ドリームタウン白樺","ディノスパーク帯広 北海道帯広市白樺16条西2丁目ドリームタウン白樺"
"ディノスパーク札幌手稲店","北海道札幌市手稲区前田1条11丁目メルシャンプラースビル3階","ディノスパーク札幌手稲店 北海道札幌市手稲区前田1条11丁目メルシャンプラースビル3階"
"ディノスパーク苫小牧","北海道苫小牧市柳町3丁目1-20イオン苫小牧2階","ディノスパーク苫小牧 北海道苫小牧市柳町3丁目1-20イオン苫小牧2階"
"ディノスパーク音更店","北海道河東郡音更町木野大通西15丁目2番地12 ビッグマート B棟","ディノスパーク音更店 北海道河東郡音更町木野大通西15丁目2番地12 ビッグマート B棟"
"トヤマレジャーランド呉羽店","富山県富山市高木2054","トヤマレジャーランド呉羽店 富山県富山市高木2054"
"トライセン中津","大分県中津市下池永67-3","トライセン中津 大分県中津市下池永67-3"
"トライセン萩原","大分県大分市萩原4-227-7 ACS3F","トライセン萩原 大分県大分市萩原4-227-7 ACS3F"
"ドットコム葛西","東京都江戸川区中葛西3-35-5 パーラー英2F","ドットコム葛西 東京都江戸川区中葛西3-35-5 パーラー英2F"
"ドラマ八王子高倉店","東京都八王子市高倉町55-4ドラマ八王子高倉","ドラマ八王子高倉店 東京都八王子市高倉町55-4ドラマ八王子高倉"
"ドラマ港北インター店","神奈川県横浜市都筑区東方町321-6","ドラマ港北インター店 神奈川県横浜市都筑区東方町321-6"
"ドラマ瑞穂店","東京都西多摩郡瑞穂町大字武蔵382-1ドラマ瑞穂","ドラマ瑞穂店 東京都西多摩郡瑞穂町大字武蔵382-1ドラマ瑞穂"
"ドラマ藤沢店","神奈川県藤沢市本藤沢5-6-8ドラマ藤沢","ドラマ藤沢店 神奈川県藤沢市本藤沢5-6-8ドラマ藤沢"
"ドラマ足利店","栃木県足利市朝倉町244-1ドラマ足利","ドラマ足利店 栃木県足利市朝倉町244-1ドラマ足利"
"ドリームキャンディー","三重県伊賀市小田町711","ドリームキャンディー 三重県伊賀市小田町711"
"ドリームファクトリーいわき店","福島県いわき市中央台飯野4-1MEGAドン・キホーテラパークいわき","ドリームファクトリーいわき店 福島県いわき市中央台飯野4-1MEGAドン・キホーテラパークいわき"
"ネオブラボー","山口県防府市高倉1-3-30","ネオブラボー 山口県防府市高倉1-3-30"
"ネオ・アミューズメントスペースa-cho","京都府京都市中京区寺町通四条上る東大文字町302-303A-breakビル2・3F","ネオ・アミューズメントスペースa-cho 京都府京都市中京区寺町通四条上る東大文字町302-303A-breakビル2・3F"
"ハイテクランドキューデン","東京都足立区西新井栄町2-7-2球殿2F","ハイテクランドキューデン 東京都足立区西新井栄町2-7-2球殿2F"
"ハイテクランドセガ立石","東京都葛飾区立石7-2-1ハイテクランドセガ立石","ハイテクランドセガ立石 東京都葛飾区立石7-2-1ハイテクランドセガ立石"
"ハイテクランドセガ西中島","大阪府大阪市淀川区西中島3-16-8深井センタービル1・2F","ハイテクランドセガ西中島 大阪府大阪市淀川区西中島3-16-8深井センタービル1・2F"
"ハローズガーデン加古川店","兵庫県加古川市別府町緑町2イトーヨーカドー加古川店3階","ハローズガーデン加古川店 兵庫県加古川市別府町緑町2イトーヨーカドー加古川店3階"
"ハローズガーデン厚木店","神奈川県厚木市中町1-5-10厚木ガーデンシティビル5階","ハローズガーデン厚木店 神奈川県厚木市中町1-5-10厚木ガーデンシティビル5階"
"バイパスレジャーランド加賀店","石川県加賀市箱宮町ヲ1-1","バイパスレジャーランド加賀店 石川県加賀市箱宮町ヲ1-1"
"バイパスレジャーランド藤江新館","石川県金沢市藤江南2ー105","バイパスレジャーランド藤江新館 石川県金沢市藤江南2ー105"
"バイパスレジャーランド藤江本館","石川県金沢市藤江南2-41","バイパスレジャーランド藤江本館 石川県金沢市藤江南2-41"
"パスカランド鳥栖","佐賀県佐賀県鳥栖市本鳥栖町537-1 フレスポ鳥栖店2F","パスカランド鳥栖 佐賀県佐賀県鳥栖市本鳥栖町537-1 フレスポ鳥栖店2F"
"パスカランド黒崎店","福岡県北九州市八幡西区西曲里町3-1イオンタウン黒崎 2F","パスカランド黒崎店 福岡県北九州市八幡西区西曲里町3-1イオンタウン黒崎 2F"
"パスカワールドグリーンランド店","熊本県荒尾市本井手1574-54パスカワールドグリーンランド","パスカワールドグリーンランド店 熊本県荒尾市本井手1574-54パスカワールドグリーンランド"
"パスカワールド宇土店","熊本県宇土市善道寺町綾織95宇土シティモール","パスカワールド宇土店 熊本県宇土市善道寺町綾織95宇土シティモール"
"パルケデアミーゴ","山形県山形市嶋北1-3-1","パルケデアミーゴ 山形県山形市嶋北1-3-1"
"ビッグボウル杉戸","埼玉県北葛飾郡杉戸町杉戸2338","ビッグボウル杉戸 埼玉県北葛飾郡杉戸町杉戸2338"
"ビデオゲームミュージアムロボット 深谷店","埼玉県深谷市上柴町西4-12-1キャラゲット深谷","ビデオゲームミュージアムロボット 深谷店 埼玉県深谷市上柴町西4-12-1キャラゲット深谷"
"ビバーチャ","広島県広島市中区南竹屋町10-17","ビバーチャ 広島県広島市中区南竹屋町10-17"
"ビーカム松森店","宮城県仙台市泉区松森斎兵衛58-1","ビーカム松森店 宮城県仙台市泉区松森斎兵衛58-1"
"ピタゴラス和歌山店","和歌山県和歌山市土入73-1和歌山グランドボウル","ピタゴラス和歌山店 和歌山県和歌山市土入73-1和歌山グランドボウル"
"ピンクパンサー下妻","茨城県下妻市小島884-10","ピンクパンサー下妻 茨城県下妻市小島884-10"
"ピンクパンサー土浦店","茨城県土浦市木田余4585-3ピンクパンサー土浦店","ピンクパンサー土浦店 茨城県土浦市木田余4585-3ピンクパンサー土浦店"
"ピンクパンサー日立店","茨城県日立市東多賀町5-10-10ピンクパンサー日立","ピンクパンサー日立店 茨城県日立市東多賀町5-10-10ピンクパンサー日立"
"ピンクパンサー水戸けやき台店","茨城県水戸市酒門町3276-1ピンクパンサー水戸けやき台","ピンクパンサー水戸けやき台店 茨城県水戸市酒門町3276-1ピンクパンサー水戸けやき台"
"ピンクパンサー水戸赤塚店","茨城県水戸市河和田1-1ピンクパンサー水戸赤塚","ピンクパンサー水戸赤塚店 茨城県水戸市河和田1-1ピンクパンサー水戸赤塚"
"ファンタジードーム八戸","青森県八戸市江陽2-14-1ラピア八戸別棟","ファンタジードーム八戸 青森県八戸市江陽2-14-1ラピア八戸別棟"
"ファンタジープラザ名古屋店","愛知県名古屋市北区玄馬町234-1ドン・キホーテ名古屋本店2F","ファンタジープラザ名古屋店 愛知県名古屋市北区玄馬町234-1ドン・キホーテ名古屋本店2F"
"フォルム武蔵境","東京都武蔵野市境南町2-7-20ダイアパレス第2 1F","フォルム武蔵境 東京都武蔵野市境南町2-7-20ダイアパレス第2 1F"
"フタバボウル関大前店","大阪府吹田市千里山東1-7-18","フタバボウル関大前店 大阪府吹田市千里山東1-7-18"
"フレスパランドカッタの湯","山口県宇部市海南町1675","フレスパランドカッタの湯 山口県宇部市海南町1675"
"ブラックジャックアクア店","広島県広島市安佐南区大町東4-12-11","ブラックジャックアクア店 広島県広島市安佐南区大町東4-12-11"
"ブラックジャック東広島店","広島県東広島市西条町御薗宇6120賀茂ボール","ブラックジャック東広島店 広島県東広島市西条町御薗宇6120賀茂ボール"
"プラサカプコン イオンタウン佐沼店","宮城県登米市南方町新島前46-1イオンタウン佐沼1階","プラサカプコン イオンタウン佐沼店 宮城県登米市南方町新島前46-1イオンタウン佐沼1階"
"プラサカプコン京都店","京都府京都市右京区西院追分町25-1イオン京都五条3階","プラサカプコン京都店 京都府京都市右京区西院追分町25-1イオン京都五条3階"
"プラサカプコン吉祥寺店","東京都武蔵野市吉祥寺本町1-10-1いなりやビル1階","プラサカプコン吉祥寺店 東京都武蔵野市吉祥寺本町1-10-1いなりやビル1階"
"プラサカプコン大分店","大分県大分市公園通り西2-1イオンパークプレイス大分2階","プラサカプコン大分店 大分県大分市公園通り西2-1イオンパークプレイス大分2階"
"プラサカプコン大曲店","秋田県大仙市和合坪立177イオン大曲2階","プラサカプコン大曲店 秋田県大仙市和合坪立177イオン大曲2階"
"プラサカプコン富津店","千葉県富津市青木124-1イオンモール富津","プラサカプコン富津店 千葉県富津市青木124-1イオンモール富津"
"プラサカプコン広島店","広島県広島市佐伯区石内東4-1-1ジ アウトレット広島1F","プラサカプコン広島店 広島県広島市佐伯区石内東4-1-1ジ アウトレット広島1F"
"プラサカプコン府中店","東京都府中市宮町1-41-2ミッテン府中店7階","プラサカプコン府中店 東京都府中市宮町1-41-2ミッテン府中店7階"
"プラサカプコン徳重店","愛知県名古屋市緑区元徳重1-505ヒルズウォーク徳重ガーデンズ","プラサカプコン徳重店 愛知県名古屋市緑区元徳重1-505ヒルズウォーク徳重ガーデンズ"
"プラサカプコン志都呂店","静岡県浜松市西区志都呂町2丁目37-1イオンモール浜松志都呂3階","プラサカプコン志都呂店 静岡県浜松市西区志都呂町2丁目37-1イオンモール浜松志都呂3階"
"プラサカプコン成田店","千葉県成田市ウイング土屋24イオン成田2階","プラサカプコン成田店 千葉県成田市ウイング土屋24イオン成田2階"
"プラサカプコン新居浜店","愛媛県新居浜市前田町8-8イオン新居浜2階","プラサカプコン新居浜店 愛媛県新居浜市前田町8-8イオン新居浜2階"
"プラサカプコン横須賀店","神奈川県横須賀市若松町2-30モアーズシティ4階ゲームコーナー","プラサカプコン横須賀店 神奈川県横須賀市若松町2-30モアーズシティ4階ゲームコーナー"
"プラサカプコン池袋店","東京都豊島区東池袋1-30-3 キュープラザ3階","プラサカプコン池袋店 東京都豊島区東池袋1-30-3 キュープラザ3階"
"プラサカプコン甲府店","山梨県中巨摩郡昭和町西条字北河原3717プラサカプコン甲府","プラサカプコン甲府店 山梨県中巨摩郡昭和町西条字北河原3717プラサカプコン甲府"
"プラサカプコン直方店","福岡県直方市湯野原2-1-1イオン直方2階","プラサカプコン直方店 福岡県直方市湯野原2-1-1イオン直方2階"
"プラサカプコン石巻店","宮城県石巻市蛇田新金沼170イオン石巻2階","プラサカプコン石巻店 宮城県石巻市蛇田新金沼170イオン石巻2階"
"プラサカプコン磯子店","神奈川県横浜市磯子区磯子1-1-1マリコム磯子ショッピングセンター2階","プラサカプコン磯子店 神奈川県横浜市磯子区磯子1-1-1マリコム磯子ショッピングセンター2階"
"プラサカプコン稲沢店","愛知県稲沢市長野7丁目1-2リーフウォーク稲沢2階","プラサカプコン稲沢店 愛知県稲沢市長野7丁目1-2リーフウォーク稲沢2階"
"プラサカプコン羽生店","埼玉県羽生市川崎2-281-3イオンモール羽生2階","プラサカプコン羽生店 埼玉県羽生市川崎2-281-3イオンモール羽生2階"
"プラサカプコン藤井寺店","大阪府藤井寺市岡2-10-11イオン藤井寺ショッピングセンター2F","プラサカプコン藤井寺店 大阪府藤井寺市岡2-10-11イオン藤井寺ショッピングセンター2F"
"プラサカプコン高知店","高知県高知市秦南町1丁目4番8号イオンモール高知東館3階","プラサカプコン高知店 高知県高知市秦南町1丁目4番8号イオンモール高知東館3階"
"プレイタウン・パル富士吉田店","山梨県富士吉田市新西原4丁目12-15","プレイタウン・パル富士吉田店 山梨県富士吉田市新西原4丁目12-15"
"プレイドーム松山","愛媛県松山市余戸南4丁目 9-40","プレイドーム松山 愛媛県松山市余戸南4丁目 9-40"
"プレイランドイン黒部","富山県黒部市沓掛645","プレイランドイン黒部 富山県黒部市沓掛645"
"プレイランドキング円町","京都府京都市中京区西ノ京西円町40","プレイランドキング円町 京都府京都市中京区西ノ京西円町40"
"プレビトナリエ四日市店","三重県四日市市安島1-3-31トナリエ5階","プレビトナリエ四日市店 三重県四日市市安島1-3-31トナリエ5階"
"ベネクス川越","埼玉県川越市大仙波340-1","ベネクス川越 埼玉県川越市大仙波340-1"
"ポート24八事店","愛知県名古屋市昭和区広路町北石坂102-4","ポート24八事店 愛知県名古屋市昭和区広路町北石坂102-4"
"ポート24幸田店","愛知県額田郡幸田町大字相見字沖原1-3カメリアガーデン幸田","ポート24幸田店 愛知県額田郡幸田町大字相見字沖原1-3カメリアガーデン幸田"
"ポート24浜松店","静岡県浜松市西区坪井町4183ポート24浜松","ポート24浜松店 静岡県浜松市西区坪井町4183ポート24浜松"
"マックスプラザ善通寺","香川県善通寺市中村町1798-2マックスプラザ善通寺","マックスプラザ善通寺 香川県善通寺市中村町1798-2マックスプラザ善通寺"
"マトリクス前橋","群馬県前橋市小相木町558-1","マトリクス前橋 群馬県前橋市小相木町558-1"
"マリンガーデンららぽーとTOKYO-BAY","千葉県船橋市浜町2-2-2ららぽーとTOKYO-BAY西館3F","マリンガーデンららぽーとTOKYO-BAY 千葉県船橋市浜町2-2-2ららぽーとTOKYO-BAY西館3F"
"マンガ倉庫 八代店","熊本県八代市沖町3989-1","マンガ倉庫 八代店 熊本県八代市沖町3989-1"
"マンガ倉庫 浦添店","沖縄県浦添市城間2689-1","マンガ倉庫 浦添店 沖縄県浦添市城間2689-1"
"マンガ倉庫八女","福岡県八女市吉田123","マンガ倉庫八女 福岡県八女市吉田123"
"マンガ倉庫都城","宮崎県都城市吉尾町840","マンガ倉庫都城 宮崎県都城市吉尾町840"
"マンガ倉庫飯塚店","福岡県飯塚市楽市769-1","マンガ倉庫飯塚店 福岡県飯塚市楽市769-1"
"マンガ倉庫鹿児島","鹿児島県鹿児島市小松原1-6-7","マンガ倉庫鹿児島 鹿児島県鹿児島市小松原1-6-7"
"マンガ倉庫鹿屋店","鹿児島県鹿屋市 寿 8-714-2","マンガ倉庫鹿屋店 鹿児島県鹿屋市 寿 8-714-2"
"ミラクルイン中村橋","東京都練馬区貫井1-1-2 YKビル2F","ミラクルイン中村橋 東京都練馬区貫井1-1-2 YKビル2F"
"ムトス相模原店","神奈川県相模原市中央区中央2-1-5ムトス内","ムトス相模原店 神奈川県相模原市中央区中央2-1-5ムトス内"
"メガパレス遊スペースアローズ","兵庫県神戸市西区丸塚2-9-18メガパレス2階","メガパレス遊スペースアローズ 兵庫県神戸市西区丸塚2-9-18メガパレス2階"
"メジャーロード24","新潟県見附市今町4丁目20番地568番地1メジャーロード24","メジャーロード24 新潟県見附市今町4丁目20番地568番地1メジャーロード24"
"メジャーロード白根店","新潟県新潟市南区上下諏訪木論地948-2メジャーロード白根","メジャーロード白根店 新潟県新潟市南区上下諏訪木論地948-2メジャーロード白根"
"メジャーロード黒埼店","新潟県新潟市西区山田3303メジャーロード黒埼","メジャーロード黒埼店 新潟県新潟市西区山田3303メジャーロード黒埼"
"モンキートリック","大阪府寝屋川市香里南之町32-5YNレジデンス香里2F","モンキートリック 大阪府寝屋川市香里南之町32-5YNレジデンス香里2F"
"モンテカルロ深谷店","埼玉県深谷市西島町3-1-2","モンテカルロ深谷店 埼玉県深谷市西島町3-1-2"
"モーリーファンタジーLINKS UMEDA店","大阪府大阪市北区大深町4-8LINKS UMEDA 5F","モーリーファンタジーLINKS UMEDA店 大阪府大阪市北区大深町4-8LINKS UMEDA 5F"
"モーリーファンタジーいわき店","福島県いわき市平字三倉68-1イオンいわき3階","モーリーファンタジーいわき店 福島県いわき市平字三倉68-1イオンいわき3階"
"モーリーファンタジーとなみ店","富山県砺波市中神一丁目174番地イオンモールとなみ2階","モーリーファンタジーとなみ店 富山県砺波市中神一丁目174番地イオンモールとなみ2階"
"モーリーファンタジー・f 富士南店","静岡県富士市鮫島118-10イオンタウン富士南2階","モーリーファンタジー・f 富士南店 静岡県富士市鮫島118-10イオンタウン富士南2階"
"モーリーファンタジー・f 岐阜店","岐阜県岐阜市正木中1-2-1イオン岐阜北館 イオン3F","モーリーファンタジー・f 岐阜店 岐阜県岐阜市正木中1-2-1イオン岐阜北館 イオン3F"
"モーリーファンタジー・f 新潟南店","新潟県新潟市江南区下早通柳田1丁目1番1号イオンモール新潟南2階","モーリーファンタジー・f 新潟南店 新潟県新潟市江南区下早通柳田1丁目1番1号イオンモール新潟南2階"
"モーリーファンタジー・f 新瑞橋店","愛知県名古屋市南区菊住1丁目7-10イオン新瑞橋3階","モーリーファンタジー・f 新瑞橋店 愛知県名古屋市南区菊住1丁目7-10イオン新瑞橋3階"
"モーリーファンタジー・f 綾川店","香川県綾歌郡綾川町萱原822-1イオンモール綾川3階","モーリーファンタジー・f 綾川店 香川県綾歌郡綾川町萱原822-1イオンモール綾川3階"
"モーリーファンタジー・f岡山店","岡山県岡山市北区下石井1丁目2番1号イオンモール岡山4階","モーリーファンタジー・f岡山店 岡山県岡山市北区下石井1丁目2番1号イオンモール岡山4階"
"モーリーファンタジー・f広島祇園店","広島県広島市安佐南区祇園3丁目2-1イオンモール広島祇園3階","モーリーファンタジー・f広島祇園店 広島県広島市安佐南区祇園3丁目2-1イオンモール広島祇園3階"
"モーリーファンタジー・f茨木店","大阪府茨木市松ヶ本町8-30-5イオン茨木4階","モーリーファンタジー・f茨木店 大阪府茨木市松ヶ本町8-30-5イオン茨木4階"
"モーリーファンタジー上尾店","埼玉県上尾市愛宕3-8-1イオンモール上尾2階","モーリーファンタジー上尾店 埼玉県上尾市愛宕3-8-1イオンモール上尾2階"
"モーリーファンタジー上磯店","北海道北斗市七重浜4-44-1イオン上磯1階","モーリーファンタジー上磯店 北海道北斗市七重浜4-44-1イオン上磯1階"
"モーリーファンタジー下妻店","茨城県下妻市堀籠972-1イオンモール下妻2階","モーリーファンタジー下妻店 茨城県下妻市堀籠972-1イオンモール下妻2階"
"モーリーファンタジー伊勢ララパーク店","三重県伊勢市小木町曽弥538イオンタウン伊勢ララパーク2階","モーリーファンタジー伊勢ララパーク店 三重県伊勢市小木町曽弥538イオンタウン伊勢ララパーク2階"
"モーリーファンタジー北戸田店","埼玉県戸田市美女木東1-3-1イオン北戸田2階","モーリーファンタジー北戸田店 埼玉県戸田市美女木東1-3-1イオン北戸田2階"
"モーリーファンタジー大塔店","長崎県佐世保市大塔町14-2イオン大塔3階","モーリーファンタジー大塔店 長崎県佐世保市大塔町14-2イオン大塔3階"
"モーリーファンタジー姫路大津店","兵庫県姫路市大津区大津町2丁目5番イオンモール姫路大津2階","モーリーファンタジー姫路大津店 兵庫県姫路市大津区大津町2丁目5番イオンモール姫路大津2階"
"モーリーファンタジー富士宮店","静岡県富士宮市浅間町1-8イオン富士宮2階","モーリーファンタジー富士宮店 静岡県富士宮市浅間町1-8イオン富士宮2階"
"モーリーファンタジー川崎店","神奈川県川崎市幸区小倉5-19-23クロスガーデン川崎","モーリーファンタジー川崎店 神奈川県川崎市幸区小倉5-19-23クロスガーデン川崎"
"モーリーファンタジー延岡店","宮崎県延岡市旭町2-2-1イオン延岡2階","モーリーファンタジー延岡店 宮崎県延岡市旭町2-2-1イオン延岡2階"
"モーリーファンタジー旭川西店","北海道旭川市緑町23-2161-3イオン旭川西2階","モーリーファンタジー旭川西店 北海道旭川市緑町23-2161-3イオン旭川西2階"
"モーリーファンタジー明石店","兵庫県明石市大久保町ゆりのき通り2-3-1イオン明石ショッピングセンター3階","モーリーファンタジー明石店 兵庫県明石市大久保町ゆりのき通り2-3-1イオン明石ショッピングセンター3階"
"モーリーファンタジー木更津店","千葉県木更津市築地1-4イオンモール木更津","モーリーファンタジー木更津店 千葉県木更津市築地1-4イオンモール木更津"
"モーリーファンタジー東久留米店","東京都東久留米市南沢5-17イオン東久留米3階","モーリーファンタジー東久留米店 東京都東久留米市南沢5-17イオン東久留米3階"
