"ザ・サードプラネットフレスポ八潮店","埼玉県八潮市大瀬822-1フレスポ八潮3階","ザ・サードプラネットフレスポ八潮店 埼玉県八潮市大瀬822-1フレスポ八潮3階"
"ザ・サードプラネット富士店","静岡県富士市永田町2-99ザ・サードプラネット富士","ザ・サードプラネット富士店 静岡県富士市永田町2-99ザ・サードプラネット富士"
"ザ・サードプラネット焼津","静岡県焼津市八楠3-18-5ザ・サードプラネット焼津","ザ・サードプラネット焼津 静岡県焼津市八楠3-18-5ザ・サードプラネット焼津"
"ザ・サードプラネット荒尾店","熊本県荒尾市原万田700-1","ザ・サードプラネット荒尾店 熊本県荒尾市原万田700-1"
"ザ・サードプラネット高崎","群馬県高崎市下和田町5-3-8メディアメガ高崎","ザ・サードプラネット高崎 群馬県高崎市下和田町5-3-8メディアメガ高崎"
"シルクハット 八王子","東京都八王子市旭町2-5八王子ツインタワービル3階","シルクハット 八王子 東京都八王子市旭町2-5八王子ツインタワービル3階"
"シルクハット 大船","神奈川県鎌倉市大船1-24大船駅前ビル1階、2階、3階","シルクハット 大船 神奈川県鎌倉市大船1-24大船駅前ビル1階、2階、3階"
"シルクハット 川口","埼玉県川口市栄町3-1-16イート川口ビル4階","シルクハット 川口 埼玉県川口市栄町3-1-16イート川口ビル4階"
"シルクハット 川崎ダイス","神奈川県川崎市川崎区駅前本町8番地ダイスビル地下2階","シルクハット 川崎ダイス 神奈川県川崎市川崎区駅前本町8番地ダイスビル地下2階"
"シルクハット 川崎モアーズ","神奈川県川崎市川崎区駅前本町7番地岡田屋モアーズ1・2階","シルクハット 川崎モアーズ 神奈川県川崎市川崎区駅前本町7番地岡田屋モアーズ1・2階"
"シルクハット 津田沼","千葉県習志野市津田沼1-2-1十三ビル 地下1階","シルクハット 津田沼 千葉県習志野市津田沼1-2-1十三ビル 地下1階"
"シルクハット 蒲田西口","東京都大田区西蒲田7-2-3第二醍醐ビル地下1階ー2階","シルクハット 蒲田西口 東京都大田区西蒲田7-2-3第二醍醐ビル地下1階ー2階"
"シルクハット伊勢佐木町","神奈川県横浜市中区伊勢佐木町3-96日活会館3F","シルクハット伊勢佐木町 神奈川県横浜市中区伊勢佐木町3-96日活会館3F"
"シルクハット大森店","東京都大田区山王2-2-15","シルクハット大森店 東京都大田区山王2-2-15"
"シルクハット本厚木","神奈川県厚木市中町3-4-22第二会田ビル2F","シルクハット本厚木 神奈川県厚木市中町3-4-22第二会田ビル2F"
"シルクハット横須賀中央","神奈川県横須賀市若松町1-5 横須賀プライム2階","シルクハット横須賀中央 神奈川県横須賀市若松町1-5 横須賀プライム2階"
"シーサイドリゾートアミューズメントパーク","栃木県宇都宮市睦町7-3","シーサイドリゾートアミューズメントパーク 栃木県宇都宮市睦町7-3"
"ジョイランドアミューズ諏訪店","静岡県沼津市大諏訪叶20-2ジョイランドアミューズ諏訪","ジョイランドアミューズ諏訪店 静岡県沼津市大諏訪叶20-2ジョイランドアミューズ諏訪"
"ジョイランド三島","静岡県三島市梅名308-6","ジョイランド三島 静岡県三島市梅名308-6"
"ジョイランド敦賀店","福井県敦賀市木崎40-12","ジョイランド敦賀店 福井県敦賀市木崎40-12"
"スタジオプリモ宇都宮店","栃木県宇都宮市曲師町2-8","スタジオプリモ宇都宮店 栃木県宇都宮市曲師町2-8"
"スタジオプリモ本八幡店","千葉県市川市八幡2-15-10パティオ5F","スタジオプリモ本八幡店 千葉県市川市八幡2-15-10パティオ5F"
"スペースV1 廿日市","広島県廿日市市本町4-23","スペースV1 廿日市 広島県廿日市市本町4-23"
"スペースワン","福岡県小郡市小郡1466-3","スペースワン 福岡県小郡市小郡1466-3"
"スポラ九品寺","熊本県熊本市中央区九品寺5-10-15","スポラ九品寺 熊本県熊本市中央区九品寺5-10-15"
"スポラ菊陽","熊本県菊池郡菊陽町 津久礼駄飼代 2617-2","スポラ菊陽 熊本県菊池郡菊陽町 津久礼駄飼代 2617-2"
"スポーツウェーブ鉄腕24浜野店","千葉県千葉市中央区浜野町1025-59","スポーツウェーブ鉄腕24浜野店 千葉県千葉市中央区浜野町1025-59"
"スポーツウェーブ鉄腕24稲毛長沼店","千葉県千葉市稲毛区長沼原町694","スポーツウェーブ鉄腕24稲毛長沼店 千葉県千葉市稲毛区長沼原町694"
"スーパーウェーブ静岡店","静岡県静岡市清水区鳥坂860 フレスポ静岡2F西","スーパーウェーブ静岡店 静岡県静岡市清水区鳥坂860 フレスポ静岡2F西"
"スーパーノバ イオン仙台中山","宮城県仙台市泉区南中山1丁目35-57 別館3階","スーパーノバ イオン仙台中山 宮城県仙台市泉区南中山1丁目35-57 別館3階"
"スーパーノバ仙台一番町","宮城県 仙台市青葉区 一番町 4-5-13 サンシャインビル1F","スーパーノバ仙台一番町 宮城県 仙台市青葉区 一番町 4-5-13 サンシャインビル1F"
"スーパーノバ仙台利府店","宮城県宮城郡利府町加瀬前谷地55-1利府ベアガーデン","スーパーノバ仙台利府店 宮城県宮城郡利府町加瀬前谷地55-1利府ベアガーデン"
"スーパーノバ会津インター店","福島県会津若松市町北町上荒久田宮下142スーパーノバ会津インター","スーパーノバ会津インター店 福島県会津若松市町北町上荒久田宮下142スーパーノバ会津インター"
"スーパーノバ天童店","山形県天童市南町1―5―26らら・パーク天童","スーパーノバ天童店 山形県天童市南町1―5―26らら・パーク天童"
"スーパーノバ福島店","福島県福島市黒岩中島7-2スーパーノバ福島","スーパーノバ福島店 福島県福島市黒岩中島7-2スーパーノバ福島"
"セガワールド豊科","長野県安曇野市豊科南穂高1115セガワールド豊科","セガワールド豊科 長野県安曇野市豊科南穂高1115セガワールド豊科"
"セガワールド高山","岐阜県高山市上岡本町7丁目7","セガワールド高山 岐阜県高山市上岡本町7丁目7"
"ソニックワールド伊万里店","佐賀県伊万里市二里町八谷搦189番地3ソニックワールド伊万里","ソニックワールド伊万里店 佐賀県伊万里市二里町八谷搦189番地3ソニックワールド伊万里"
"ソニックワールド大村店","長崎県大村市古賀島町383-1ソニックワールド大村","ソニックワールド大村店 長崎県大村市古賀島町383-1ソニックワールド大村"
"ソユーエンターテイメントスタジオ須賀川店","福島県須賀川市古河105番イオンタウン須賀川B棟内","ソユーエンターテイメントスタジオ須賀川店 福島県須賀川市古河105番イオンタウン須賀川B棟内"
"ソユーゲームフィールド堺鉄砲町店","大阪府堺市堺区鉄砲町1番地イオンモール堺鉄砲町3階","ソユーゲームフィールド堺鉄砲町店 大阪府堺市堺区鉄砲町1番地イオンモール堺鉄砲町3階"
"ソユーゲームフィールド旭川西店","北海道旭川市緑町23-2161-3イオン旭川西3階","ソユーゲームフィールド旭川西店 北海道旭川市緑町23-2161-3イオン旭川西3階"
"ソユーゲームフィールド木更津店","千葉県木更津市築地1番4イオンモール木更津2階","ソユーゲームフィールド木更津店 千葉県木更津市築地1番4イオンモール木更津2階"
"ソユーゲームフィールド札幌発寒店","北海道札幌市西区発寒八条12-1-1イオンモール札幌発寒3F","ソユーゲームフィールド札幌発寒店 北海道札幌市西区発寒八条12-1-1イオンモール札幌発寒3F"
"ソユーゲームフィールド盛岡南店","岩手県盛岡市本宮7-1-1イオン盛岡南1F","ソユーゲームフィールド盛岡南店 岩手県盛岡市本宮7-1-1イオン盛岡南1F"
"ソユーゲームフィールド能代店","秋田県能代市鰄渕字古屋布1番 イオンタウン能代内","ソユーゲームフィールド能代店 秋田県能代市鰄渕字古屋布1番 イオンタウン能代内"
"ソユーゲームフィールド菖蒲","埼玉県久喜市菖蒲町菖蒲6005番地1号モラージュ菖蒲3F","ソユーゲームフィールド菖蒲 埼玉県久喜市菖蒲町菖蒲6005番地1号モラージュ菖蒲3F"
"ソユートイズニューヨーク守谷","茨城県守谷市百合ケ丘3―249―1イオンタウン守谷2階","ソユートイズニューヨーク守谷 茨城県守谷市百合ケ丘3―249―1イオンタウン守谷2階"
"ソユーファミリーゲームフィールド花巻店","岩手県花巻市高木第16地割68-6銀河モール花巻","ソユーファミリーゲームフィールド花巻店 岩手県花巻市高木第16地割68-6銀河モール花巻"
"ソユーフォレストハンター松前店","愛媛県伊予郡松前町筒井850エミフルMASAKI1階","ソユーフォレストハンター松前店 愛媛県伊予郡松前町筒井850エミフルMASAKI1階"
"タイトFーステーション郡山オリエントパーク","福島県郡山市安積町荒井字大久保35-1","タイトFーステーション郡山オリエントパーク 福島県郡山市安積町荒井字大久保35-1"
"タイト―Fステーション川崎ルフロン店","神奈川県川崎市川崎区日進町1-11川崎ルフロン10F","タイト―Fステーション川崎ルフロン店 神奈川県川崎市川崎区日進町1-11川崎ルフロン10F"
"タイトーFステーション オリナス錦糸町店","東京都墨田区太平4―1-2オリナスモール地下1階","タイトーFステーション オリナス錦糸町店 東京都墨田区太平4―1-2オリナスモール地下1階"
"タイトーFステーション セントポルタ大分店","大分県大分市中央町2‐1-1","タイトーFステーション セントポルタ大分店 大分県大分市中央町2‐1-1"
"タイトーFステーション ニシムタ出水店","鹿児島県出水市六月田町347","タイトーFステーション ニシムタ出水店 鹿児島県出水市六月田町347"
"タイトーFステーション マルイファミリー志木店","埼玉県志木市本町5-26-1 マルイファミリー志木店 7F","タイトーFステーション マルイファミリー志木店 埼玉県志木市本町5-26-1 マルイファミリー志木店 7F"
"タイトーFステーション モラージュ佐賀店","佐賀県佐賀市巨勢町牛島730モラージュ佐賀2F","タイトーFステーション モラージュ佐賀店 佐賀県佐賀市巨勢町牛島730モラージュ佐賀2F"
"タイトーFステーション 山口メルクス店","山口県山口市大字黒川82-1ハイパーモールメルクス山口","タイトーFステーション 山口メルクス店 山口県山口市大字黒川82-1ハイパーモールメルクス山口"
"タイトーFステーション 近江八幡店","滋賀県近江八幡市鷹飼町南3-7イオン近江八幡","タイトーFステーション 近江八幡店 滋賀県近江八幡市鷹飼町南3-7イオン近江八幡"
"タイトーFステーションVAL小山","栃木県小山市城山町3-3-22 VAL小山駅ビル3F","タイトーFステーションVAL小山 栃木県小山市城山町3-3-22 VAL小山駅ビル3F"
"タイトーFステーションゆめタウンみゆき","広島県広島市南区宇品西6-7-14ゆめタウンみゆき2階","タイトーFステーションゆめタウンみゆき 広島県広島市南区宇品西6-7-14ゆめタウンみゆき2階"
"タイトーFステーションゆめタウン東広島店","広島県東広島市西条土与丸1-5-7ゆめタウン東広島4階","タイトーFステーションゆめタウン東広島店 広島県東広島市西条土与丸1-5-7ゆめタウン東広島4階"
"タイトーFステーションりんくうシークル店","大阪府泉佐野市りんくう往来3りんくうPTシークル","タイトーFステーションりんくうシークル店 大阪府泉佐野市りんくう往来3りんくうPTシークル"
"タイトーFステーションイオンモール浜松市野店","静岡県浜松市東区天王町1981-3イオンモール浜松市野2F","タイトーFステーションイオンモール浜松市野店 静岡県浜松市東区天王町1981-3イオンモール浜松市野2F"
"タイトーFステーションイオン伊勢原店","神奈川県伊勢原市白根630-1イオン伊勢原3F","タイトーFステーションイオン伊勢原店 神奈川県伊勢原市白根630-1イオン伊勢原3F"
"タイトーFステーションイオン富士宮店","静岡県富士宮市浅間町1番8号イオン富士宮3階","タイトーFステーションイオン富士宮店 静岡県富士宮市浅間町1番8号イオン富士宮3階"
"タイトーFステーションイオン新潟西店","新潟県新潟市西区小新南2-1-10イオン新潟西3F","タイトーFステーションイオン新潟西店 新潟県新潟市西区小新南2-1-10イオン新潟西3F"
"タイトーFステーションクレアモール川越店","埼玉県川越市新富町2-1-13カシーラ川越1Fから4F","タイトーFステーションクレアモール川越店 埼玉県川越市新富町2-1-13カシーラ川越1Fから4F"
"タイトーFステーションダイエー大宮","埼玉県さいたま市大宮区桜木町2‐3大宮西口共同ビル6F","タイトーFステーションダイエー大宮 埼玉県さいたま市大宮区桜木町2‐3大宮西口共同ビル6F"
"タイトーFステーショントナリエ宇都宮","栃木県宇都宮市駅前通り1-4-6トナリエ宇都宮B1","タイトーFステーショントナリエ宇都宮 栃木県宇都宮市駅前通り1-4-6トナリエ宇都宮B1"
"タイトーFステーションマルナカ新倉敷店","岡山県倉敷市玉島爪崎981-1マルナカ新倉敷","タイトーFステーションマルナカ新倉敷店 岡山県倉敷市玉島爪崎981-1マルナカ新倉敷"
"タイトーFステーションラザウォーク甲斐双葉店","山梨県甲斐市志田字柿木616-1ラザウォーク甲斐双葉アミューズメント棟1F","タイトーFステーションラザウォーク甲斐双葉店 山梨県甲斐市志田字柿木616-1ラザウォーク甲斐双葉アミューズメント棟1F"
"タイトーFステーション三宮","兵庫県神戸市中央区三宮町2-11-1神戸センタープラザ3F","タイトーFステーション三宮 兵庫県神戸市中央区三宮町2-11-1神戸センタープラザ3F"
"タイトーFステーション上越店","新潟県上越市富岡3524J-MAXシアター内1F","タイトーFステーション上越店 新潟県上越市富岡3524J-MAXシアター内1F"
"タイトーFステーション八戸店","青森県八戸市三日町27","タイトーFステーション八戸店 青森県八戸市三日町27"
"タイトーFステーション前橋リリカ","群馬県前橋市国領町2-14-1前橋リリカ2F","タイトーFステーション前橋リリカ 群馬県前橋市国領町2-14-1前橋リリカ2F"
"タイトーFステーション吉祥寺JOY","東京都武蔵野市吉祥寺本町1-8-23河田ビル1F","タイトーFステーション吉祥寺JOY 東京都武蔵野市吉祥寺本町1-8-23河田ビル1F"
"タイトーFステーション向ヶ丘遊園","神奈川県川崎市多摩区登戸2718-1","タイトーFステーション向ヶ丘遊園 神奈川県川崎市多摩区登戸2718-1"
"タイトーFステーション坂東店","茨城県坂東市辺田1104-1ヨークベニマル坂東","タイトーFステーション坂東店 茨城県坂東市辺田1104-1ヨークベニマル坂東"
"タイトーFステーション姫路","兵庫県姫路市駅前町269‐270","タイトーFステーション姫路 兵庫県姫路市駅前町269‐270"
"タイトーFステーション小山店","栃木県小山市喜沢1475おやまゆうえんハーヴェストウォーク","タイトーFステーション小山店 栃木県小山市喜沢1475おやまゆうえんハーヴェストウォーク"
"タイトーFステーション市川妙典店","千葉県市川市妙典4-1-1イオン市川妙典2番街2階","タイトーFステーション市川妙典店 千葉県市川市妙典4-1-1イオン市川妙典2番街2階"
"タイトーFステーション柏中央","千葉県柏市十余二249-5","タイトーFステーション柏中央 千葉県柏市十余二249-5"
"タイトーFステーション燕三条店","新潟県燕市井土巻3-150イオン県央1階","タイトーFステーション燕三条店 新潟県燕市井土巻3-150イオン県央1階"
"タイトーFステーション盛岡南店","岩手県盛岡市津志田町2-1-77","タイトーFステーション盛岡南店 岩手県盛岡市津志田町2-1-77"
"タイトーFステーション郡山アティ店","福島県郡山市駅前1-16-7郡山アティ7F","タイトーFステーション郡山アティ店 福島県郡山市駅前1-16-7郡山アティ7F"
"タイトーFステーション野市店","高知県香南市野市町西野2007-1フジグラン野市","タイトーFステーション野市店 高知県香南市野市町西野2007-1フジグラン野市"
"タイトーFステーション静岡店","静岡県静岡市葵区呉服町二丁目5番地4ふしみや第2ビル","タイトーFステーション静岡店 静岡県静岡市葵区呉服町二丁目5番地4ふしみや第2ビル"
"タイトーステーション 国分寺店","東京都国分寺市本町3-5-11","タイトーステーション 国分寺店 東京都国分寺市本町3-5-11"
"タイトーステーション 所沢店","埼玉県所沢市日吉町3番7号スカイビュウビル1、2F","タイトーステーション 所沢店 埼玉県所沢市日吉町3番7号スカイビュウビル1、2F"
"タイトーステーション 立川北口店","東京都立川市曙町2-4-5","タイトーステーション 立川北口店 東京都立川市曙町2-4-5"
"タイトーステーション 船橋","千葉県船橋市本町1丁目6-1タイトーステーション船橋","タイトーステーション 船橋 千葉県船橋市本町1丁目6-1タイトーステーション船橋"
"タイトーステーションBIGBOX高田馬場","東京都新宿区高田馬場1-35-3BIGBOX6階","タイトーステーションBIGBOX高田馬場 東京都新宿区高田馬場1-35-3BIGBOX6階"
"タイトーステーションBIGFUN平和島店","東京都大田区平和島 1-1-1BIGFUN平和島3F","タイトーステーションBIGFUN平和島店 東京都大田区平和島 1-1-1BIGFUN平和島3F"
"タイトーステーションアミュプラザおおいた","大分県大分市要町1-14アミュプラザおおいた4階","タイトーステーションアミュプラザおおいた 大分県大分市要町1-14アミュプラザおおいた4階"
"タイトーステーションファボーレ婦中店","富山県富山市婦中町下轡田165-1フューチャーシティファボーレ2階","タイトーステーションファボーレ婦中店 富山県富山市婦中町下轡田165-1フューチャーシティファボーレ2階"
"タイトーステーションフェドラ大須店","愛知県名古屋市中区大須3丁目30番地31号萬松寺駐車場ビル1階","タイトーステーションフェドラ大須店 愛知県名古屋市中区大須3丁目30番地31号萬松寺駐車場ビル1階"
"タイトーステーション上野御徒町","東京都台東区上野4-6-9","タイトーステーション上野御徒町 東京都台東区上野4-6-9"
"タイトーステーション仙台クリスロード店","宮城県仙台市青葉区中央2-3-25","タイトーステーション仙台クリスロード店 宮城県仙台市青葉区中央2-3-25"
"タイトーステーション仙台ベガロポリス店","宮城県仙台市太白区西多賀5-24-1ベガロポリス","タイトーステーション仙台ベガロポリス店 宮城県仙台市太白区西多賀5-24-1ベガロポリス"
"タイトーステーション仙台名掛丁店","宮城県仙台市青葉区中央1-7-13ハピナ名掛丁商街","タイトーステーション仙台名掛丁店 宮城県仙台市青葉区中央1-7-13ハピナ名掛丁商街"
"タイトーステーション千歳","北海道千歳市北栄2-12-5","タイトーステーション千歳 北海道千歳市北栄2-12-5"
"タイトーステーション和光店","埼玉県和光市丸山台1-4-5タイトーステーション和光","タイトーステーション和光店 埼玉県和光市丸山台1-4-5タイトーステーション和光"
"タイトーステーション大宮店","埼玉県さいたま市大宮区大門町一丁目1番地タイトーステーション大宮","タイトーステーション大宮店 埼玉県さいたま市大宮区大門町一丁目1番地タイトーステーション大宮"
"タイトーステーション大阪日本橋店","大阪府大阪市浪速区日本橋4-9-14タイトーステーション大阪日本橋","タイトーステーション大阪日本橋店 大阪府大阪市浪速区日本橋4-9-14タイトーステーション大阪日本橋"
"タイトーステーション大須店","愛知県名古屋市中区大須3-20-7タイトーステーション大須","タイトーステーション大須店 愛知県名古屋市中区大須3-20-7タイトーステーション大須"
"タイトーステーション小田原シティーモールクレッセ店","神奈川県小田原市前川120小田原シティーモールクレッセ2F","タイトーステーション小田原シティーモールクレッセ店 神奈川県小田原市前川120小田原シティーモールクレッセ2F"
"タイトーステーション小田原店","神奈川県小田原市栄町1-3-12","タイトーステーション小田原店 神奈川県小田原市栄町1-3-12"
"タイトーステーション広島本通店","広島県広島市中区本通3-5タイトーステーション広島本通","タイトーステーション広島本通店 広島県広島市中区本通3-5タイトーステーション広島本通"
"タイトーステーション広島紙屋町店","広島県広島市中区紙屋町2ー2-21タイトーステーション広島紙屋町","タイトーステーション広島紙屋町店 広島県広島市中区紙屋町2ー2-21タイトーステーション広島紙屋町"
"タイトーステーション弥富","愛知県弥富市五明蒲原1371-4タイトーステーション弥富","タイトーステーション弥富 愛知県弥富市五明蒲原1371-4タイトーステーション弥富"
"タイトーステーション戸塚西口店","神奈川県横浜市戸塚区戸塚町4023番地","タイトーステーション戸塚西口店 神奈川県横浜市戸塚区戸塚町4023番地"
"タイトーステーション新宿南口GW店","東京都新宿区新宿3-35-8タイトーステーション新宿南口GW","タイトーステーション新宿南口GW店 東京都新宿区新宿3-35-8タイトーステーション新宿南口GW"
"タイトーステーション新宿東口店","東京都新宿区新宿3-22-7指田ビル","タイトーステーション新宿東口店 東京都新宿区新宿3-22-7指田ビル"
"タイトーステーション旭サンモール店","千葉県旭市イ-2676-1イオン旭3F","タイトーステーション旭サンモール店 千葉県旭市イ-2676-1イオン旭3F"
"タイトーステーション札幌狸小路2丁目店","北海道札幌市中央区南三条西2-14","タイトーステーション札幌狸小路2丁目店 北海道札幌市中央区南三条西2-14"
"タイトーステーション柏店","千葉県柏市柏2-3-1フーサワビル","タイトーステーション柏店 千葉県柏市柏2-3-1フーサワビル"
"タイトーステーション横浜西口五番街店","神奈川県横浜市西区南幸1-12-9タイトーステーション横浜西口五番街","タイトーステーション横浜西口五番街店 神奈川県横浜市西区南幸1-12-9タイトーステーション横浜西口五番街"
"タイトーステーション池袋西口","東京都豊島区西池袋1丁目15番9号西池ビル","タイトーステーション池袋西口 東京都豊島区西池袋1丁目15番9号西池ビル"
"タイトーステーション浅草","東京都台東区浅草1-27-3タイトーステーション浅草","タイトーステーション浅草 東京都台東区浅草1-27-3タイトーステーション浅草"
"タイトーステーション海老名ビナウォーク店","神奈川県海老名市中央1ー18-1ビナウォーク6番館2F","タイトーステーション海老名ビナウォーク店 神奈川県海老名市中央1ー18-1ビナウォーク6番館2F"
"タイトーステーション渋谷店","東京都渋谷区渋谷1-24-12渋谷東映プラザ1階 タイトーステーション内","タイトーステーション渋谷店 東京都渋谷区渋谷1-24-12渋谷東映プラザ1階 タイトーステーション内"
