サンゲームス都城北店,宮崎県都城市上川東4-5997-4
サンシャイン,岩手県盛岡市大通２ー７ー２１ジュリアンビル１階
ザ・サードプラネット多摩センター店,東京都多摩市落合１−４１−１マグレブウェスト１階・２階
シネパーク広,広島県呉市広中町１−９
シルクハット　伊勢佐木町,神奈川県横浜市中区伊勢佐木町３—９６日活会館３階
シルクハット　八王子,東京都八王子市旭町２−５　八王子ツインタワービル３階
シルクハット　大船,神奈川県鎌倉市大船１−２４　大船駅前ビル１〜３Ｆ
シルクハット　川口,埼玉県川口市栄町３−１−１６イート川口ビル４Ｆ
シルクハット　川崎ダイス,神奈川県川崎市川崎区駅前本町８番地ダイスビル地下２階
シルクハット　横須賀中央,神奈川県横須賀市若松町１−５プライムビル２階
シルクハット　津田沼,千葉県習志野市津田沼１−２−１十三ビル地下１階
シルクハット　蒲田西口,東京都大田区西蒲田７−２−３第二醍醐ビル地下１階〜２階
シルクハット川崎モアーズ,神奈川県川崎市川崎区駅前本町７番地　岡田屋モアーズ１・２階
シルクハット本厚木,神奈川県厚木市中町３−４−２２第二会田ビル２階
シーサイドリゾートアミューズメントパーク,栃木県宇都宮市睦町７−３
ジョイプラザ豊岡店,兵庫県豊岡市加広町７−３２コープデイズ豊岡内
ジョイランドアミューズみしま,静岡県三島市梅名３０８−６
ジョイランドアミューズ諏訪店,静岡県沼津市大諏訪２０−２
ジョイランド中原,神奈川県川崎市中原区上小田中6-19-6
ジーパラ出雲,島根県出雲市渡橋町７８４−１
ジーパラ博多,福岡県福岡市博多区東光寺町２丁目６番４０号ｺﾏｰｼｬﾙﾓｰﾙ博多２階
スタジオプリモ宇都宮店,栃木県宇都宮市曲師町2-8宇都宮フェスタ1F
スタジオプリモ山形店,山形県山形市城南町１−１−１　霞城セントラル２Ｆ
スタジオプリモ本八幡店,千葉県市川市八幡２−１５−１０パティオ５階
スタジオプリモ水戸店,茨城県水戸市宮町１−２−４マイム１F
スタジオプリモ沼津,静岡県沼津市大手町３−４−１沼津ラクーン３Ｆ
スペースV1廿日市店,広島県廿日市市本町４−２３
スポラ九品寺,熊本県熊本市中央区九品寺5丁目10-15
スポラ菊陽,熊本県菊池郡菊陽町津久礼駄飼代２６１７−２
スポーツウェーブ鉄腕24,千葉県千葉市中央区浜野町1025-59
スポーツウェーブ鉄腕24稲毛長沼店,千葉県千葉市稲毛区長沼原町697番地
スポーツセンター　２１世紀,大阪府堺市南区岩室108-1
スーパーウェーブ静岡,静岡県静岡市清水区鳥坂８６０
スーパーノバイオン仙台中山,宮城県仙台市泉区南中山１−３５−５７別館３Ｆ
スーパーノバ仙台利府,宮城県宮城郡利府町加瀬字新前谷地５５−１
スーパーノバ福島,福島県福島市黒岩字中島7-2
スーパービバホーム新習志野店２階,千葉県習志野市茜浜１−１−２　スーパービバホーム２Ｆ
セガあまがさきキューズモール,兵庫県尼崎市潮江1-3-1あまがさきキューズモール内4F
セガつかしん,兵庫県尼崎市塚口本町4-8-1つかしん内
セガみらい長崎ココウォーク,長崎県長崎市茂里町1-55みらい長崎ココウォーク5F
セガららぽーとTOKYO−BAY,千葉県船橋市浜町2-1-1北館1F
セガアミュプラザくまもと,熊本県熊本市西区春日三丁目１５番２６号６Ｆ　６１８区画
セガアミュプラザみやざき,宮崎県宮崎市老松２丁目２番２２号アミュプラザみやざき　うみ館
セガアリーナ中間,福岡県中間市上蓮花寺3-1-1
セガアリーナ蘇我,千葉県千葉市中央区川崎町51-1ハーバーシティ蘇我FW AM棟1F
セガアルプラザ金沢,石川県金沢市諸江町30-1
セガイオンモール岡山,岡山県岡山市北区下石井1-2-1ｲｵﾝﾓｰﾙ岡山6F　
セガイオンモール木曽川,愛知県一宮市木曽川町黒田八ヶ池25-1　イオンモール木曽川3F
セガイト—ヨーカドー古淵,神奈川県相模原市南区古淵3-13-33 イトーヨーカドー3F
セガエイスクエア草津,滋賀県草津市西渋川1-23-23エイスクエアSARA南館2階
セガコロワ甲子園,兵庫県西宮市甲子園高潮町3−3Crowa甲子園3F
セガセンター南,神奈川県横浜市都筑区茅ヶ崎中央３−２５
セガビバモール寝屋川,大阪府寝屋川市寝屋南2-22-2ビバモール寝屋川 モール棟2F
セガフェニックスプラザ摩耶,兵庫県神戸市灘区味泥町6-1フェニックスプラザ1F
セガプライムツリー赤池,愛知県日進市赤池町箕ノ手1番
セガマーゴ関,岐阜県関市倉知516
セガミスト２,大阪府大阪市北区梅田１−１１−４駅前第４ビルＢ１Ｆ
セガワールドサンスパおおむら,長崎県大村市森園町663-3
セガワールドフジグラン,高知県高知市朝倉東町52-15 フジグラン高知3F
セガワールド中津,大分県中津市沖代町1-2-16
セガワールド六地蔵,京都府京都市伏見区桃山町山ノ下32京都SCビルAM棟2F
セガワールド勿来,福島県いわき市勿来町四沢字鍵田13
セガワールド和泉,大阪府和泉市肥子町2-4-41
セガワールド宇都宮,栃木県宇都宮市東宿郷5-1-7
セガワールド布施,大阪府東大阪市長堂1-1-1ロンモール布施内
セガワールド成田,千葉県成田市東町157-5
セガワールド松原,大阪府堺市東区八下町3-10
セガワールド枚方,大阪府枚方市須山町83-1サンシャインプラザ枚方内
セガワールド福山,広島県福山市瀬戸町大字山北300
セガワールド米子,鳥取県米子市両三柳2778-2
セガワールド葛西,東京都江戸川区東葛西9-3-3イトーヨーカドー3F
セガワールド豊科,長野県安曇野市豊科南穂高1115
セガワールド高城,大分県大分市牧1-161-8
セガワールド高山,岐阜県高山市上岡本町7-7
セガワールドＭＥＧＡ,広島県広島市安佐南区中筋4-11-7
セガ上田,長野県上田市大字上田1847-1
セガ丸亀,香川県丸亀市蓬莱町56-1
セガ今福,大阪府大阪市城東区今福東1-9-34
セガ倉敷,岡山県倉敷市西中新田535-2
セガ南町田ＧＢＰシアター,東京都町田市鶴間３−４−１ワンダーシアター１階Ｈ１０３区画
セガ小田原ダイナシティ,神奈川県小田原市中里296-1 ダイナシティイーストモール3F
セガ小郡,山口県山口市小郡前田町3-6ロックタウン
セガ尾道,広島県尾道市新浜1-2-13
セガ幕張,千葉県千葉市美浜区ひび野1-8メッセ・アミューズ・モール１Ｆ
セガ庄内,山形県東田川郡三川町猪字大堰端３２６番地６
セガ延岡,宮崎県延岡市平原町5-1492-8
セガ徳島スエヒロボウル,徳島県徳島市南末広町4-95-2
セガ我孫子,千葉県我孫子市柴崎字天王谷47-1
セガ新三国アルゴ７,大阪府豊中市神州町1-15
セガ明石,兵庫県明石市魚住町清水2464-1
セガ有明ガーデン,東京都江東区有明２−１−８有明ガーデン５Ｆ５０１区画
セガ東京ドームシティ,東京都文京区後楽1-3-61
セガ東大阪,大阪府東大阪市稲田新町3-9-64
セガ松山,愛媛県松山市枝松5-7-32
セガ松江,島根県松江市嫁島町12-15
セガ武雄,佐賀県武雄市武雄町富岡12517-1
セガ海田,広島県安芸郡海田町南大正町3-35
セガ海老名,神奈川県海老名市中央一丁目４番３１号海老名プラザビル１階
セガ甲西,滋賀県湖南市夏見字二ツ橋356-1
セガ静岡,静岡県静岡市葵区七間町4番地
セガ高松,香川県高松市勅使町535
セガ鳥取,鳥取県鳥取市安長416
セガＬＥＣＴ広島,広島県広島市西区扇町2-1-45LECT2F
ソユーゲームフィールド三川店,山形県東田川郡三川町大字猪子字和田庫１２８−１イオン三川１Ｆ
ソユーゲームフィールド上大岡店,神奈川県横浜市港南区上大岡西１−１８−３　ミオカリスト館６階
ソユーゲームフィールド八戸店,青森県八戸市沼館4-7-112八戸ピアドゥＢ棟2F
ソユーゲームフィールド天童店,山形県天童市芳賀タウン北４−１−１ イオンモール天童２Ｆ
ソユーゲームフィールド小名浜店,福島県いわき市小名浜字辰巳町７９イオンモールいわき小名浜３Ｆ
ソユーゲームフィールド川口店,埼玉県川口市並木元町１−７９　アリオ川口３Ｆ
ソユーゲームフィールド新発田店,新潟県新発田市住吉町５丁目１１番５号　イオンモール新発田２Ｆ
ソユーゲームフィールド旭川駅前店,北海道旭川市宮下通７−２−５ｲｵﾝﾓｰﾙ旭川駅前４F
ソユーゲームフィールド木更津店,千葉県木更津市築地１−４イオンモール木更津２F
ソユーゲームフィールド泉南店,大阪府泉南市りんくう南浜３番１２イオンモールりんくう泉南２Ｆ
ソユーゲームフィールド発寒,北海道札幌市西区発寒8条12丁目1　イオン札幌発寒SC3F
ソユーゲームフィールド盛岡南,岩手県盛岡市本宮7-1-1ｲｵﾝﾓｰﾙ盛岡南1F
ソユーゲームフィールド苗穂店,北海道札幌市東区東苗穂2条3-1-1　イオンモール札幌苗穂２Ｆ
ソユーゲームフィールド菖蒲店,埼玉県久喜市菖蒲町菖蒲６００５番地１　モラージュ菖蒲３Ｆ
ソユーゲームフィールド釜石店,岩手県釜石市港町２−１−１イオンタウン釜石店３F
ソユーゲームフィールド長野店,長野県長野市三輪９−４３−２４イオンタウン長野三輪店
ソユーゲームフィールド青森店,青森県青森市浜田1-14-1イトーヨーカドー青森店2F
ソユースペースファンタジーインフィニ,青森県弘前市城東北３−１０−１さくら野百貨店弘前店４Ｆ
ソユーファミリーゲームフィールド花巻店,岩手県花巻市高木第１６地割６８−６　銀河モール１Ｆ
ソユーファミリーゲームフィールド防府店,山口県防府市鐘紡町７−１イオンタウン防府1F
ソユーフォレストハンター松前店,愛媛県伊予郡松前町筒井８５０ＡＭ棟１階
ソユープレイランドソピア八王子店,東京都八王子市狭間町1462-1イトーヨーカドー八王子店3F
ソユープレイランドソピア幕張店,千葉県千葉市花見川区幕張町4-417-25イトーヨーカドー幕張店2F
ソユー竜宮タウン静岡店,静岡県静岡市駿河区石田1-5-1アピタ静岡ＳＣ2Ｆ
タイトーFステーション柏中央,千葉県柏市十余二２４９−５
タイトーアミュプラザ鹿児島店,鹿児島県鹿児島市中央町１−１アミュプラザ鹿児島５Ｆ
タイトーキッズランドＧＡＺＡ,愛知県豊田市喜多町１−１４０ＧＡＺＡ３階
タイトーステーション アリオ八尾店,大阪府八尾市光町２−３　イトーヨーカドーアリオ八尾３Ｆ
タイトーステーション ファボーレ婦中店,富山県富山市婦中町下轡田１６５−１フューチャーファボーレ２F
タイトーステーション 上野アメ横店,東京都台東区上野４−１０−１７
タイトーステーション 仙台クリスロード店,宮城県仙台市青葉区中央２−３−２５
タイトーステーション 仙台名掛丁店,宮城県仙台市青葉区中央１−７−１３
タイトーステーション 千歳店,北海道千歳市北栄２−１２−５
タイトーステーション 和光店,埼玉県和光市丸山台１−４−５
タイトーステーション 大宮店,埼玉県さいたま市大宮区大門町１−１
タイトーステーション 大阪日本橋店,大阪府大阪市浪速区日本橋４−９−１４
タイトーステーション 大須店,愛知県名古屋市中区大須３−２０−７
タイトーステーション 宇都宮ベルモール店,栃木県宇都宮市陽東６−２−１ベルモール内２Ｆ
タイトーステーション 小田原店,神奈川県小田原市栄町１−３−１２
タイトーステーション 広島本通店,広島県広島市中区本通３−５せらかぐ本通ビル
タイトーステーション 広島紙屋町店,広島県広島市中区紙屋町２−２−２１
タイトーステーション 弥富店,愛知県弥富市五明１３７１−４
タイトーステーション 戸塚西口店,神奈川県横浜市戸塚区戸塚町４０２３
タイトーステーション 所沢店,埼玉県所沢市日吉町３−７
タイトーステーション 札幌狸小路２丁目店,北海道札幌市中央区南３条西２丁目−１４
タイトーステーション 柏店,千葉県柏市柏２−３−１フーサワビル
タイトーステーション 横浜西口五番街店,神奈川県横浜市西区南幸１−１２ー９
タイトーステーション 池袋西口店,東京都豊島区西池袋１−１５−９第一西池ビル
タイトーステーション 浅草店,東京都台東区浅草１−２７−５ＲＯＸ ＤＯＭＥ１Ｆ
タイトーステーション 渋谷店,東京都渋谷区渋谷１−２４−１２渋谷東映プラザ
タイトーステーション 町田店,東京都町田市原町田６−２１−２３　松山ビル１階
タイトーステーション 盛岡マッハランド店,岩手県盛岡市上堂１−２−３８マッハランド内
タイトーステーション 福岡天神店,福岡県福岡市中央区天神２−６−３５サザンクロスビル
タイトーステーション 秋葉原店,東京都千代田区外神田４−２−２貴三ビル
タイトーステーション 藤沢店,神奈川県藤沢市南藤沢２１−１
タイトーステーション 金沢店,石川県金沢市片町２−１−７宇都宮片町ビル
タイトーステーション 錦糸町楽天地店,東京都墨田区江東橋４−２７−１４楽天地ビルＢ１Ｆ
タイトーステーション 難波店,大阪府大阪市中央区難波千日前１５−１２
タイトーステーションフェドラ大須店,愛知県名古屋市中区大須３−３０−３１
タイトーステーション国分寺店,東京都国分寺市本町３−５−１１
タイトーステーション摂津富田店,大阪府高槻市大畑町１３−１　イオン摂津富田店２階
タイトーステーション新宿東口店,東京都新宿区新宿３−２２−７　指田ビル
タイトーステーション新浜松ザザシティ店,静岡県浜松市中区鍛冶町１５サザンシティ西館２Ｆ
タイトーステーション海老名ビナウォーク店,神奈川県海老名市中央１−１８−１　ビナウォーク６番館２Ｆ
タイトーステーション溝の口,神奈川県川崎市高津区溝口１−１１−８ＯＫＫＡ６３４ビル３階
タイトーステーション立川北口店,東京都立川市曙町２−４−５クリサス立川２・３Ｆ
タイトーステーションＢＩＧＦＵＮ平和島店,東京都大田区平和島１丁目１−１ＢＩＧＦＵＮ平和島
タイトー小田原シティーモール店,神奈川県小田原市前川１２０　フレスポ小田原シティーモール２Ｆ
タイトー新宿南口ゲームワールド店,東京都新宿区新宿３−３５−８
タイトーＢＩＧＢＯＸ高田馬場店,東京都新宿区高田馬場１−３５−３　ＢＩＧＢＯＸ６Ｆ
タイトーＦステーション 燕三条店,新潟県燕市井土巻３−１５０イオン県央店アメニティ棟１Ｆ
タイトーＦステーションアル・プラザ鯖江店,福井県鯖江市下河端町１６−１６−１アルプラザ鯖江アミューズ棟内
タイトーＦステーションオリナス錦糸町店,東京都墨田区太平4-1-2オリナスモール地下1F
タイトーＦステーションクレアモール川越店,埼玉県川越市新富町２−１−１３
タイトーＦステーションセントポルタ大分店,大分県大分市中央町２−１−１
タイトーＦステーションマルナカ新倉敷店,岡山県倉敷市玉島爪崎９８１−１
タイトーＦステーション上越店,新潟県上越市富岡3524 J-MAXシアター内1F
タイトーＦステーション南大沢店,東京都八王子市南大沢２−３ｆａｂ南大沢２Ｆ
タイトーＦステーション吉祥寺ＪＯＹ店,東京都武蔵野市吉祥寺本町１丁目８‐２３　河田ビル
タイトーＦステーション市川妙典店,千葉県市川市妙典4-1-1　イオン市川妙典店2番街2F
タイトーＦ郡山オリエントパーク店,福島県郡山市安積町荒井字大久保３５−１
ダイナソアエイジ,愛知県大府市東新町三丁目８８番地
チャリオット五井店,千葉県市原市五井中央西２−１−２
チャリオット辰巳店,千葉県市原市市原500-1
テクノワールド,岩手県奥州市江刺区愛宕字梁川127-1
トヤマレジャーランド呉羽店,富山県富山市高木字貝塚2054
トライセン中津店,大分県中津市下池永６７−３
トライセン萩原,大分県大分市萩原４−２２７−７
ドットコム葛西,東京都江戸川区中葛西３−３５−５
ドラマ八王子高倉店,東京都八王子市高倉町55-4
ドラマ港北インター店,神奈川県横浜市都筑区東方町321-6
ドラマ瑞穂店,東京都西多摩郡瑞穂町武蔵382-1
ドラマ藤沢店,神奈川県藤沢市本藤沢5-6-8
ドラマ足利店,栃木県足利市朝倉町244-1
ドリームキャンディ,三重県伊賀市小田町７１１−１
ナムコプラボ宇都宮店,栃木県宇都宮市簗瀬町１６０６−１　Ｐ＆Ｄビル
ナムコランドわさだ店,大分県大分市大字玉沢字楠本７５５−１トキハわさだタウン内２Ｆ
ネオブラボー,山口県防府市高倉１−３−３０
ネバーランド2座間店,神奈川県座間市ひばりが丘４−１１−４８
ネバーランド港北店,神奈川県横浜市都筑区中川中央1-36-16
ハイテクセガもみの木村,長崎県諫早市小川町90-1
ハイテクセガ新居浜,愛媛県新居浜市徳常町6-8
ハイテクランドキューデン,東京都足立区西新井栄町2-7-2
ハイテクランドセガハーバープレイス,大分県別府市餅ヶ浜町161-2
ハイテクランドセガ渋谷,東京都渋谷区渋谷１−１４−１４ＥＳＴ１階・７階
ハイテクランドセガ立石,東京都葛飾区立石7-2-1
ハイテクランドセガ西中島,大阪府大阪市淀川区西中島3-16-8深井センタービル1・2F
ハイパーメッセ,福岡県北九州市小倉南区北方4-6-7
ハローズガーデン新三田店,兵庫県三田市けやき台１−６−４三田ウッディタウンサティ２番街
バイパスレジャーランド加賀店,石川県加賀市箱宮町ヲ1-1
バイパスレジャーランド藤江新館,石川県金沢市藤江南2-105
バンバン衣山店,愛媛県松山市衣山１−２４８−１
パスカランドはません,熊本県熊本市南区田井島1-2-1ゆめタウンはません3F
パスカワールドグリーンランド店,熊本県荒尾市本井手１５７４−５４
パラダイス・シティ,神奈川県横浜市旭区二俣川1-43-28
パラボランド小牧店,愛知県小牧市東1-126　イオン小牧店２F
パルケ上賀茂店,京都府京都市北区上賀茂西河原１−１
パームトップス,神奈川県厚木市中町4-15-9
ビッグボウル杉戸,埼玉県北葛飾郡杉戸町大字杉戸２３３８
ビバーチャ,広島県広島市中区南竹屋町１０−１７
ビルボードプレイスゲームコーナー,新潟県新潟市中央区八千代2-5-7
ビーカム成沢店,山形県山形市成沢西５−３−２７
ビーカム松森店,宮城県仙台市泉区松森字斎兵衛５８−１
ピタゴラス和歌山,和歌山県和歌山市土入７３−１
ピノッキースパティオ益田店,島根県益田市高津7丁目21-12ゆめタウン益田店2F
ピンクパンサーつくばみらい店,茨城県つくばみらい市陽光台1-14-1
ピンクパンサー下妻店,茨城県下妻市小島884-10
ピンクパンサー土浦店,茨城県土浦市木田余４５８５−３
ピンクパンサー日立店,茨城県日立市東多賀町5-10-10
ピンクパンサー水戸けやき台店,茨城県水戸市酒門町3276-1
ピンクパンサー水戸赤塚店,茨城県水戸市河和田1-1
ファンタジスタ,岡山県倉敷市新倉敷駅前５−１９４
ファンタジープラザ名古屋,愛知県名古屋市北区玄馬町２３４−１ﾄﾞﾝｷﾎｰﾃ名古屋本店２階
フォルム武蔵境,東京都武蔵野市境南町２−７−２０ダイヤパレス第２　１階
フクイレジャーランドワイプラザ店,福井県福井市新保北1-303　ヤスサキワイプラザＢ棟2Ｆ
フタバボウル泉大津店,大阪府泉大津市松之浜町１−２−５３
フタバ図書アルティランド,広島県広島市西区草津南４−７−１　アルパーク北棟２Ｆ
フタバ図書ＧＩＧＡ春日店,福岡県春日市昇町8-1-1
フレスパランドカッタの湯,山口県宇部市海南町1675
ブラックジャックアクア店,広島県広島市安佐南区大町東４−１２−１１
ブラックジャック東広島店,広島県東広島市西条町御薗宇6120
プラサカプコン京都店,京都府京都市右京区西院追分町２５−１イオンモール京都五条３Ｆ
プラサカプコン吉祥寺店,東京都武蔵野市吉祥寺本町1-10-1いなりやビルB1F
プラサカプコン大分店,大分県大分市公園通り西２−１パークプレイス大分２Ｆ
プラサカプコン大曲店,秋田県大仙市和合字坪立１７７イオン大曲ＳＣ２Ｆ
プラサカプコン富津店,千葉県富津市青木1-5-1イオンモール富津内ゲームコーナー
プラサカプコン広島店,広島県広島市佐伯区石内東４丁目１−１ジアウトレット広島
プラサカプコン徳重店,愛知県名古屋市緑区鳴海町徳重１８−４４ヒルズウォーク徳重
プラサカプコン志都呂店,静岡県浜松市西区志都呂町二丁目37番1号 ｲｵﾝﾓｰﾙ浜松志都呂3F
プラサカプコン成田店,千葉県成田市ウイング土屋２４イオン成田ＳＣ２Ｆ
プラサカプコン新居浜店,愛媛県新居浜市前田町８−８イオンモール新居浜２Ｆ
プラサカプコン横須賀店,神奈川県横須賀市若松町2-30モアーズシティ4F
プラサカプコン甲府店,山梨県中巨摩郡昭和町西条字北河原３７１７
プラサカプコン直方店,福岡県直方市湯野原２−１−１イオンモール直方２Ｆ
プラサカプコン石巻店,宮城県石巻市茜平4丁目104番地 ｲｵﾝ石巻ｼｮｯﾋﾟﾝｸﾞｾﾝﾀｰ2F
プラサカプコン稲沢店,愛知県稲沢市長野７丁目１−２リーフウォーク稲沢２Ｆ
プラサカプコン羽生店,埼玉県羽生市川崎２−２８１−３イオンモール羽生２階
プラサカプコン藤井寺,大阪府藤井寺市岡２丁目１０番１１号イオン藤井寺ＳＣ２Ｆ
プラサカプコン高知,高知県高知市秦南町１−４−８イオンモール高知３Ｆ
プリモピア鴻巣店,埼玉県鴻巣市北新宿２２５−１ウニクス鴻巣１階
プレイステーションネーブル西宮店,兵庫県西宮市両度町6-10
プレイゾーン　バンブー,新潟県南魚沼市竹俣６０ー５
プレイドーム松山,愛媛県松山市余戸南４丁目９−４０
プレイハウス　エリナ,新潟県新潟市西蒲区津雲田６４０
プレイランドキング円町店,京都府京都市中京区西ノ京西円町40
プレイランドソピアいとくアクロス能代店,秋田県能代市字寺向70いとくアクロス能代店内
プレイランド大和鶴間,神奈川県大和市下鶴間１−３−１イトーヨーカドー大和鶴間店３Ｆ
プレイランド川崎,神奈川県川崎市川崎区小田栄2-2-1-3F
プレビ　アリオ橋本店,神奈川県相模原市緑区大山町１−２２アリオ橋本店内２階
プレビ　トナリエ四日市,三重県四日市市安島１−３−３１トナリエ５階
ベネクス川越店,埼玉県川越市大仙波340-1
ベネクス平塚店,神奈川県平塚市四之宮６−１０−２７
ペップ魚町,福岡県北九州市小倉北区魚町２−４−２０
ポート２４八事店,愛知県名古屋市昭和区広路町北石坂102番地4
ポート２４幸田店,愛知県額田郡幸田町相見沖原1-3
ポート２４浜松店,静岡県浜松市西区坪井町4183-1
マックスプラザ善通寺,香川県善通寺市中村町１７９８−２
マトリクス前橋,群馬県前橋市小相木町５５８−１
マンガ倉庫飯塚,福岡県飯塚市楽市７６９ー１
マンガ倉庫鹿児島店,鹿児島県鹿児島市小松原1-6-7
