マークイズ静岡店,静岡県静岡市葵区柚木１９１ＭＡＲＫ ＩＳ 静岡３Ｆ
ミラクルイン中村橋,東京都練馬区貫井１−１−２ＹＫビル２Ｆ
ムトス相模原店,神奈川県相模原市中央区中央２−１−５
メジャーロード24,新潟県見附市今町4-20-568-1
メジャーロード黒埼,新潟県新潟市西区山田３３０３番地（３３０２番地）
モンキートリック,大阪府寝屋川市香里南之町32-5　YNレジデンス香里2F
モンテカルロ,埼玉県深谷市西島３−１−２
ユーズボウル久留米,福岡県久留米市東櫛原町字深町１１１０
ユーズランド下田店,青森県上北郡おいらせ町中野平４０−１イオンモール下田１Ｆ
ユーズランド倉敷店,岡山県倉敷市水江１番地イオンモール倉敷２Ｆ
ユーズランド太田店,群馬県太田市石原町８１番地イオンモール太田２Ｆ
ユーズランド日の出店,東京都西多摩郡日の出町大字平井237-3イオンモール日の出３Ｆ
ユーズランド春日部店,埼玉県春日部市下柳４２０−１イオンモール春日部２Ｆ
ユーズランド東浦店,愛知県知多郡東浦町緒川旭１３−２イオンモール東浦２Ｆ
ユーズランド水戸内原店,茨城県水戸市内原２−１イオンモール水戸内原２Ｆ
ユーズランド越谷店,埼玉県越谷市レイクタウン4-2-2イオンレイクタウンKAZE3F
ユーズランド高崎店,群馬県高崎市棟高町１４００番地イオンモール高崎２Ｆ
ラウンドワンさいたま・上里店,埼玉県児玉郡上里町大字金久保３９４−１
ラウンドワンさいたま・栗橋店,埼玉県久喜市小右衛門１９２−１
ラウンドワンさいたま・鴻巣店,埼玉県鴻巣市箕田３１６３−７
ラウンドワンみえ川越インターチェンジ店,三重県三重郡川越町南福崎８５１−１
ラウンドワンららぽーと和泉店,大阪府和泉市あゆみ野４−４−７　４階　４２１００番
ラウンドワンららぽーと新三郷店,埼玉県三郷市新三郷ららシティ3-1-1ららぽーと新三郷2F20000番
ラウンドワンららぽーと湘南平塚店,神奈川県平塚市天沼１０−１３階 ３３２８０番
ラウンドワンわらび店,埼玉県蕨市北町５−１−６
ラウンドワンアリオ柏店,千葉県柏市大島田１丁目６番地１セブンパークアリオ柏　１０７０
ラウンドワンイーアス春日井店,愛知県春日井市六軒屋町東丘２２テナント区画番号３０１０
ラウンドワンダイバーシティ東京プラザ店,東京都江東区青海1-1-10ダイバーシティ東京プラザ6階61000
ラウンドワンモレラ岐阜店,岐阜県本巣市三橋１１００
ラウンドワン三宮駅前店,兵庫県神戸市中央区小野柄通6-1-17
ラウンドワン上尾店,埼玉県上尾市大字平塚９１７−１
ラウンドワン中川１号線店,愛知県名古屋市中川区法蔵町２−２３
ラウンドワン京都伏見店,京都府京都市伏見区下鳥羽平塚町１３１
ラウンドワン京都河原町店,京都府京都市中京区河原町通三条下ル山崎町２５０
ラウンドワン仙台苦竹店,宮城県仙台市宮城野区苦竹１−７−１０
ラウンドワン伊丹店,兵庫県伊丹市昆陽７丁目２９
ラウンドワン佐賀店,佐賀県佐賀市兵庫北４−２−１
ラウンドワン入間店,埼玉県入間市小谷田３−７−２５
ラウンドワン八千代村上店,千葉県八千代市村上南１丁目５番地５４
ラウンドワン函館店,北海道函館市西桔梗町８４８−１１
ラウンドワン前橋店,群馬県前橋市天川大島町１１０１−１
ラウンドワン加古川店,兵庫県加古川市尾上町安田325番6号
ラウンドワン千日前店,大阪府大阪市中央区難波１−３−１
ラウンドワン千種店,愛知県名古屋市千種区新栄3-20-17タイホウ千種駅前南ビル8階
ラウンドワン半田店,愛知県半田市瑞穂町６−７−８
ラウンドワン南砂店,東京都江東区南砂６−７−１５トピレックプラザ４Ｆ
ラウンドワン博多半道橋店,福岡県福岡市博多区半道橋２−２−８
ラウンドワン吉祥寺店,東京都武蔵野市吉祥寺本町1-11-22
ラウンドワン名古屋西春店,愛知県北名古屋市宇福寺神明１５
ラウンドワン和歌山店,和歌山県和歌山市小雑賀７３９−３
ラウンドワン城東放出店,大阪府大阪市城東区今福南3-4-38
ラウンドワン堺中央環状店,大阪府堺市東区石原町２−２４１
ラウンドワン堺駅前店,大阪府堺市堺区戎島町4-44-3
ラウンドワン大分店,大分県大分市萩原２−１３−１７
ラウンドワン大宮店,埼玉県さいたま市大宮区宮町４−９０−７
ラウンドワン大野城店,福岡県大野城市御笠川１−１８−１６
ラウンドワン奈良・ミナーラ店,奈良県奈良市二条大路南１−３−１ミ・ナーラ５階
ラウンドワン姫路飾磨店,兵庫県姫路市飾磨区中島１−２５４
ラウンドワン宇都宮店,栃木県宇都宮市江曽島町２０７２−１
ラウンドワン守口店,大阪府守口市佐太東町２−６−１４ジャガーグリーン２Ｆ
ラウンドワン宮崎店,宮崎県宮崎市中村東３−４−６０
ラウンドワン富士店,静岡県富士市八代町４−１５
ラウンドワン小倉店,福岡県北九州市小倉北区西港町15-65
ラウンドワン山梨・石和店,山梨県笛吹市石和町広瀬７３７−１
ラウンドワン岡山妹尾店,岡山県岡山市南区妹尾３４１３−１
ラウンドワン岸和田店,大阪府岸和田市八阪町２−１１−１
ラウンドワン川崎大師店,神奈川県川崎市川崎区殿町１−５−１
ラウンドワン市原店,千葉県市原市八幡北町３−５−１
ラウンドワン市川鬼高店,千葉県市川市鬼高４−１−３
ラウンドワン広島店,広島県広島市中区立町３−１１
ラウンドワン府中本町駅前,東京都府中市本町１−１３−３カネタビル
ラウンドワン徳島・万代店,徳島県徳島市万代町４−１９−１
ラウンドワン新潟店,新潟県新潟市中央区美咲町２−１−３８
ラウンドワン旭川店,北海道旭川市永山三条１−４−７
ラウンドワン朝霞店,埼玉県朝霞市膝折町２−１６−１０
ラウンドワン札幌すすきの店,北海道札幌市中央区南五条西3-6-1
ラウンドワン札幌北２１条店,北海道札幌市東区北二十一条東１−１−２１
ラウンドワン札幌白石本通店,北海道札幌市白石区本通１６丁目北１−５０
ラウンドワン東大阪店,大阪府東大阪市若江南町１−２−１２
ラウンドワン東淀川店,大阪府大阪市東淀川区菅原７−１４−２８
ラウンドワン松山店,愛媛県松山市東長戸１−３−１０
ラウンドワン板橋店,東京都板橋区相生町１６−１３
ラウンドワン枚方店,大阪府枚方市高野道１−２０−２０
ラウンドワン梅田店,大阪府大阪市北区小松原町４−１６
ラウンドワン横浜綱島店,神奈川県横浜市港北区樽町２−６−４０Ｔ-PLATZ内
ラウンドワン横浜駅西口店,神奈川県横浜市西区南幸２−８−１６
ラウンドワン武蔵村山店,東京都武蔵村山市伊奈平３−１−１
ラウンドワン池袋店,東京都豊島区東池袋１−１４−１
ラウンドワン沖縄・南風原店,沖縄県島尻郡南風原町字兼城５５２番地
ラウンドワン沖縄・宜野湾店,沖縄県宜野湾市真志喜３−２８−８
ラウンドワン津・高茶屋店,三重県津市高茶屋小森町２７７−８
ラウンドワン浜大津アーカス店,滋賀県大津市浜町２−１浜大津アーカス内
ラウンドワン浜松店,静岡県浜松市東区天王町諏訪１９８１−１７
ラウンドワン熊本店,熊本県熊本市西区春日7-25-15
ラウンドワン町田店,東京都町田市森野１−１３−１４
ラウンドワン盛岡店,岩手県盛岡市盛岡駅西通２−１０−３５
ラウンドワン福山店,広島県福山市明神町１−９−２８
ラウンドワン福岡天神店,福岡県福岡市中央区天神２−６−１２
ラウンドワン福島店,福島県福島市太田町14-18
ラウンドワン秋田店,秋田県秋田市卸町１−１−２
ラウンドワン習志野店,千葉県習志野市芝園１−４−５
ラウンドワン草加店,埼玉県草加市谷塚上町２０４番１
ラウンドワン豊中店,大阪府豊中市名神口１−１−１
ラウンドワン豊橋店,愛知県豊橋市大岩町字岩田２７−２
ラウンドワン郡山店,福島県郡山市向河原町４−５５
ラウンドワン金沢店,石川県金沢市横川6-120-1
ラウンドワン長野店,長野県長野市大字東和田８２７番地６
ラウンドワン青森店,青森県青森市浜田３−１−１
ラウンドワン静岡・駿河店,静岡県静岡市駿河区手越７５
ラウンドワン高松店,香川県高松市松島町２−７−４３
ラウンドワン高槻店,大阪府高槻市辻子３−６−４
ラウンドワン高津店,神奈川県川崎市高津区二子４−８−１
ラウンドワン高知店,高知県高知市南宝永町４−１２
ラウンドワン鳴海店,愛知県名古屋市緑区鳴海町杜若２８
ラウンドワン鹿児島宇宿店,鹿児島県鹿児島市宇宿2-2-2
ラウンドワンＪＲ尼崎駅前店,兵庫県尼崎市潮江１−４−５プラストいきいき館４階
ラッキーバッティングドーム八千代店,千葉県八千代市大和田新田1088
ラッキー中央店・フェリシダ,千葉県千葉市中央区富士見2-8-1
ラッキー佐倉店,千葉県佐倉市井野1475
リッチモンド,熊本県八代市旭中央通２０−３
上越レジャーランボウル,新潟県上越市下門前薬島827-2
佐原ミナミボウル,千葉県香取市佐原イ-4200
千葉レジャーランド成東店,千葉県山武市姫島111-1
千葉レジャーランド稲毛店,千葉県千葉市稲毛区小仲台2-5-7海宝ビル2F
千葉レジャーランド野田店,千葉県野田市吉春776-1
半田メトロポリス,愛知県半田市旭町３−１１−１
名古屋レジャーランド内田橋店,愛知県名古屋市南区内田橋2-26-22
名古屋レジャーランド大高店,愛知県名古屋市緑区忠治山201番地
埼玉レジャーランド大宮ラクーン店,埼玉県さいたま市大宮区宮町1-60 RAKUUN５階
埼玉レジャーランド春日部店,埼玉県春日部市大字増富字谷際163-1
大垣メトロポリス,岐阜県大垣市三塚町西沼５２３−１
大田原スポーツランド,栃木県那須塩原市一区町１０４−６０
宝島　桐生店,群馬県桐生市永楽町５−１０ＭＥＧＡドン・キホーテ桐生店３Ｆ
宝島　浦和美園店,埼玉県さいたま市緑区美園５−５０−１イオンモール浦和美園２Ｆ
小牧メトロポリス,愛知県小牧市間々片山１８１
岐阜レジャーランド穂積店,岐阜県瑞穂市稲里630番地
嶺宝スポーツセンター,福島県いわき市小名浜住吉折返２−２
新宿スポーツランド本館,東京都新宿区新宿3-22-12
最後の５ドル,福岡県糟屋郡粕屋町大字仲原2706仲原ファミリープラザ2F
本八幡ゲームUNO,千葉県市川市八幡２丁目１６ー６八幡ハタビルB1F
東京レジャーランド亀有店,東京都葛飾区亀有3-21-2
東京レジャーランド吉祥寺店,東京都武蔵野市吉祥寺本町1-3-7　YSビル地下１階〜4階
東京レジャーランド池袋店,東京都豊島区東池袋１丁目１番２９号　サントロペ池袋２階３階
東京レジャーランド秋葉原2号店,東京都千代田区外神田4-3-3ミナミビル6F・7F
東京レジャーランド秋葉原店,東京都千代田区外神田1-9-5
柏ガリバー,千葉県柏市柏１−１−１１丸井ビルＢ１Ｆ
楽市楽座　イオンモール大和郡山店,奈良県大和郡山市下三橋町741-333イオンモール大和郡山店
楽市楽座くりえいと宗像,福岡県宗像市くりえいと１−４−４
楽市楽座イオンモール京都桂川店,京都府京都市南区久世高田町376-1イオンモール京都桂川店３階
楽市楽座イオンモール名古屋茶屋店,愛知県名古屋市港区西茶屋２−１１イオンモール名古屋茶屋３階
楽市楽座イオンモール四條畷店,大阪府四條畷市砂4-3-2イオンモール四條畷店3F
楽市楽座イオンモール土浦店,茨城県土浦市上高津３６７イオンモール土浦ＳＣ３階
楽市楽座イオンモール大阪ドーム店,大阪府大阪市西区千代崎３−１３−１
楽市楽座イオンモール宮崎店,宮崎県宮崎市新別府町江口８６２−１イオンモール宮崎店２Ｆ
楽市楽座イオンモール川口前川店,埼玉県川口市前川1-1-11イオンモール川口前川店3F
楽市楽座イオンモール扶桑店,愛知県丹羽郡扶桑町南山名高塚5番地イオンモール扶桑2階
楽市楽座イオンモール新小松店,石川県小松市清六町３１５イオンモール新小松店２Ｆ
楽市楽座イオンモール東員店,三重県員弁郡東員町大字長深字築田５１０−１
楽市楽座イオンモール松本店,長野県松本市中央四丁目９番５１号
楽市楽座イオンモール甲府店,山梨県中巨摩郡昭和町飯喰１５０５−１イオンモール２０１１
楽市楽座イオンモール福岡伊都店,福岡県福岡市西区北原1-3-1イオンモール福岡伊都SC別館
楽市楽座イオンモール福津店,福岡県福津市日蒔野６−１６−１　イオンモール福津店３Ｆ
楽市楽座イオンモール都城駅前店,宮崎県都城市栄町４６７２−５ｲｵﾝﾓｰﾙ都城駅前店2階
楽市楽座イオン小郡店,福岡県小郡市大保字弓場１１０
楽市楽座サンストリート浜北店,静岡県浜松市浜北区平口２８６１サンストリート浜北
楽市楽座広島店,広島県広島市南区段原南１−３−５２広島段原ＳＣ７階７００１
楽市楽座湘南藤沢店,神奈川県藤沢市辻堂新町4-3-5ﾐｽﾀｰﾏｯｸｽ湘南藤沢SC２F
楽市楽座砂津店,福岡県北九州市小倉北区砂津3-1-1チャチャタウン小倉B棟3F
楽市楽座行橋店,福岡県行橋市西泉６−１−１
楽市楽座黒崎店,福岡県北九州市八幡西区桜ヶ丘町１−３フレスポ黒崎２階
楽市街道 名古屋店,愛知県北名古屋市中之郷新明４５−１
楽市街道くるめ店,福岡県久留米市新合川2-7-10久留米アミューズメントビル内
楽市街道箱崎店,福岡県福岡市東区箱崎５丁目１番８号
沼津バッティングスタジアム,静岡県沼津市岡一色１９−２
滋賀レジャーランド大津店,滋賀県大津市におの浜３−１−４３　イオンタウンアヤハプラザ内
社スポーツレーン,兵庫県加東市社1189-1
神奈川レジャーランド厚木店,神奈川県厚木市戸室5-31-1
福井レジャーランド板垣店,福井県福井市下馬３−１０２
群馬レジャーランド伊勢崎店,群馬県伊勢崎市連取町3066-1
群馬レジャーランド太田店,群馬県太田市西矢島町162-2
群馬レジャーランド渋川店,群馬県渋川市八木原1364
群馬レジャーランド藤岡店,群馬県藤岡市中2002-1
群馬レジャーランド高崎駅東口店,群馬県高崎市江木町３３３−１高崎ＥＸビル
豊川メトロポリス,愛知県豊川市下長山町上アライ１４−１
遊スペース アローズ,兵庫県神戸市西区丸塚２丁目９−１８
遊スペース マジカル,兵庫県神戸市中央区琴ノ緒町５−２−３
遊楽舎　姫路花田店,兵庫県姫路市花田町上原田２−１ビッグエムワン2F
遊道楽新合川店,福岡県久留米市新合川1丁目6-7
関大前フタバボウル,大阪府吹田市千里山東１−７−１８
Ａ．Ｃ．グランド,岐阜県岐阜市茜部大川1-77
ＡＤＸマミー岡崎店,愛知県岡崎市井田新町６−１
ＡＤＸマミー春日井Ｒ１５５出川店,愛知県春日井市不二ヶ丘１丁目５番地
ＡｍｕｓｅｍｅｎｔｃｉｔｙＧ−ＳＴＡ,鹿児島県薩摩川内市向田本町４９番
ＢＩＮＧＯ一関,岩手県一関市山目字中野９２−１
ＦＡＳボウリングセンター,佐賀県唐津市栄町２５８１−１ＦＡＳボウリングセンター
Ｇ−ＳＴＡＧＥ七隈店,福岡県福岡市城南区七隈８−４−８
Ｇ−ＳＴＡＧＥ小倉,福岡県北九州市小倉北区浅野2-14-5あるあるCITY2階
Ｇ−ＳＴＡＧＥ飯塚店,福岡県飯塚市枝国６８０−２
Ｇ−ｐａｌａあべの,大阪府大阪市阿倍野区阿倍野筋３−１０−１あべのベルタ２Ｆ
Ｇ−ｐａｌａ小倉,福岡県北九州市小倉南区上葛原1−14−1
Ｇ−ｐａｌａ日田,大分県日田市友田997-1
Ｇ−ｐａｌａ時津,長崎県西彼杵郡時津町野田郷５９号
Ｇ３ポロスイオンタウン北上店,岩手県北上市里分四地割２０番地１
ＧＡＭＥ ＰＡＤＤＯＣＫ＋１,茨城県古河市小堤１９１６−１
ＧＡＭＥ　ＳＱＵＡＲＥ茂原店,千葉県茂原市六ツ野八貫野２７８５−１ライフガーデン茂原内
ＧＡＭＥＢＡＮＫ仙台泉店,宮城県仙台市泉区大沢２−５−４
ＧＲＥＡ,愛知県名古屋市千種区今池５−２２−１７
ＧａｍｅＦｉｅｌｄ千城台店,千葉県千葉市若葉区千城台北３丁目２１−１イコアス千城台３Ｆ
ＧｉＧＯサントムーン柿田川,静岡県駿東郡清水町玉川６１−２サントムーン柿田川２Ｆ
ＧｉＧＯマーケットスクエアささしま,愛知県名古屋市中村区平池町４丁目６０番地１４号
ＧｉＧＯ仙台,宮城県仙台市青葉区中央２−５−５三経６０ビル
ＧｉＧＯ千葉,千葉県千葉市中央区富士見２−４−１
ＧｉＧＯ南越谷ラクーン,埼玉県越谷市南越谷１丁目１５番１号南越谷ラクーン２Ｆ
ＧｉＧＯ広島本通,広島県広島市中区本通９−３０ランドマークビル１Ｆ
ＧｉＧＯ新宿西口,東京都新宿区西新宿１−１２−５Ｂ１Ｆ・１Ｆ
ＧｉＧＯ柏,千葉県柏市柏１−１−１１丸井デパート内Ｂ１Ｆ
ＧｉＧＯ福岡天神,福岡県福岡市中央区天神２−７−６ＤＡＤＡビル
ＧｉＧＯ秋葉原１号館,東京都千代田区外神田１−１０ー９
ＧｉＧＯ秋葉原３号館１,東京都千代田区外神田１−１１−１１外神田１丁目ビルディング
ＧｉＧＯ立川,東京都立川市柴崎町３−２−１サザンビル１・２Ｆ
ＧｉＧＯ金山,愛知県名古屋市熱田区金山１−１９ー２
ＧｉＧＯ難波アビオン,大阪府大阪市浪速区難波中２−３−１５　ＭＭＯビルＢ１Ｆ〜３Ｆ
ＧｉＧＯ高田馬場,東京都新宿区高田馬場４−７−５高田馬場グランド東京
ＧｉＧＯｍｏｚｏワンダーシティ,愛知県名古屋市西区二方町４０番
ＨａｐｉｐｉＬａｎｄ我孫子,千葉県我孫子市本町３−２−２８イトーヨーカドー我孫子南口店２Ｆ
Ｈｅｙ,東京都千代田区外神田１−１０−５廣瀬本社ビル１階〜４階
Ｌａ・Ｆｉｅｓｔａ,愛知県豊橋市広小路１−６−２フェイス豊橋ビルＢ１
ＭＩＲＡＩＮＯイオンモール白山店,石川県白山市横江町土地区画整理事業施行地区内１衛区１番地
ＳＯＹＵ　GAME　FIELD湘南店,神奈川県藤沢市辻堂新町4-1-1湘南モールＦＩＬＬ2F
ＳＯＹＵ　Ｅ−ＳＴＵＤＩＯ須賀川店,福島県須賀川市古河１０５イオンタウン須賀川Ｂ棟内
ＳＯＹＵ　ＧＡＭＥ　ＦＩＥＬＤ古川店,宮城県大崎市古川沢田字筒場浦１５番地イオンタウン古川内
ＳＯＹＵ　ＴＯＹ’Ｓ　ＮＹ　守谷店,茨城県守谷市百合ヶ丘3-249-1　イオンタウン守谷2Ｆ
ＳＯＹＵＧａｍｅＦｅｉｌｄ熊谷,埼玉県熊谷市銀座2-245ﾆｯﾄﾓｰﾙ4F
ＳＯＹＵＧａｍｅＦｉｅｌｄ大館店,秋田県大館市御成町三丁目７番５８号いとく大館ＳＣ３階
ＳＯＹＵＧａｍｅＦｉｅｌｄ能代店,秋田県能代市鰄渕字古屋布１番イオンタウン能代内
ＳＰＥＥＤ,山口県周南市大字久米３２１９
Ｓｐｉｃａ大宮南銀店,埼玉県さいたま市大宮区仲町1-57
ＴＨＥ　３ＲＤ　ＰＬＡＮＥＴ　富士,静岡県富士市永田町２−９９
ＶＡＭＰ中川店,愛知県名古屋市中川区新家１−２００７
ＹＡＺ寝屋川店,大阪府寝屋川市石津中町25-26
ｎａｍｃｏiiasつくば店,茨城県つくば市研究学園5-19　iiasつくば店2F2190
ｎａｍｃｏくずはモール店,大阪府枚方市楠葉花園町１０−８５ＫＵＺＵＨＡＭＡＬＬ南館２Ｆ
ｎａｍｃｏけやきウォーク前橋,群馬県前橋市文京町２−１−１けやきウォーク前橋2F
ｎａｍｃｏなんばパークス店,大阪府大阪市浪速区難波中2丁目10番70号なんばﾊﾟｰｸｽ6階
ｎａｍｃｏアリオ上田店,長野県上田市天神3-5-1アリオ上田店内
ｎａｍｃｏイオンタウン大館西店,秋田県大館市根下戸新町18-121イオンタウン大館西内
ｎａｍｃｏイオンタウン郡山店,福島県郡山市松木町２−８８イオンタウン郡山内
ｎａｍｃｏイオンモールナゴヤドーム前店,愛知県名古屋市東区矢田南4丁目102-3ｲｵﾝﾓｰﾙﾅｺﾞﾔﾄﾞｰﾑ前SC3F
ｎａｍｃｏイオンモール佐久平店,長野県佐久市佐久平駅南11-10ｲｵﾝﾓｰﾙ佐久平2階
ｎａｍｃｏイオンモール北戸田店,埼玉県戸田市美女木東１−３−１ｲｵﾝﾓｰﾙ北戸田ｼｮｯﾋﾟﾝｸﾞｾﾝﾀｰ内3F
ｎａｍｃｏイオンモール各務原店,岐阜県各務原市那加萱場町３−８イオンモール各務原店２Ｆ
ｎａｍｃｏイオンモール名取店,宮城県名取市杜せきのした5-3-1イオンモール名取2F
ｎａｍｃｏイオンモール大日店,大阪府守口市大日東町1番地18号ｲｵﾝﾓｰﾙ大日4階
ｎａｍｃｏイオンモール大高店,愛知県名古屋市緑区南大高2-450ｲｵﾝ大高3階
ｎａｍｃｏイオンモール広島府中,広島県安芸郡府中町大須2-1-1イオンモール広島府中3階
ｎａｍｃｏイオンモール鈴鹿,三重県鈴鹿市庄野羽山４−１−２イオンモール鈴鹿２Ｆ
ｎａｍｃｏイオンモール長久手店,愛知県長久手市勝入塚５０１　イオンモール長久手３Ｆ
ｎａｍｃｏイオンモール鶴見緑地店,大阪府大阪市鶴見区鶴見４−１７−１鶴見緑地４階
ｎａｍｃｏイオンモールＫＹＯＴＯ店,京都府京都市南区西九条鳥居口町1ｲｵﾝﾓｰﾙKYOTO SAKURA館4階
ｎａｍｃｏイオン具志川店,沖縄県うるま市字前原幸崎原３０３イオン具志川ＳＣ内２Ｆ
ｎａｍｃｏウイングベイ小樽店,北海道小樽市築港１１−５ウィングベイ小樽５番街３階
ｎａｍｃｏエアポートウォーク名古屋店,愛知県西春日井郡豊山町大字豊場字林先１−８エアポートウォーク
ｎａｍｃｏエルムの街ショッピングセンター,青森県五所川原市大字唐笠柳字藤巻517-1ｴﾙﾑの街SC　本棟2階
ｎａｍｃｏニッケパークタウン加古川店,兵庫県加古川市加古川町寺家町173-1
ｎａｍｃｏビバシティ彦根店,滋賀県彦根市竹ケ鼻町４３−１ビバシティ彦根２Ｆ
ｎａｍｃｏフェドラＰ＆Ｄ佐野店,栃木県佐野市高萩町１３４０
ｎａｍｃｏモラージュ佐賀店,佐賀県佐賀市巨勢町大字牛島７３０モラージュ佐賀南館１Ｆ
ｎａｍｃｏワンダーシティ南熊本店,熊本県熊本市中央区九品寺６−９−１
ｎａｍｃｏ博多バスターミナル店,福岡県福岡市博多区博多駅中央街２−１博多バスターミナル７階
ｎａｍｃｏ名古屋駅前店,愛知県名古屋市中村区椿町６−６ニッセイ名古屋西ビル別館Ｂ１
ｎａｍｃｏ大阪日本橋店,大阪府大阪市浪速区難波中2-1-17コスモビル1〜3階
ｎａｍｃｏ巣鴨店,東京都豊島区巣鴨１−１５−１宮田ビルB2F
ｎａｍｃｏ新潟店,新潟県新潟市中央区南笹口１−１−１　ひもろぎビル２Ｆ
ｎａｍｃｏ札幌エスタ店,北海道札幌市中央区北5条西2-1-1札幌エスタ9F
ｎａｍｃｏ松戸店,千葉県松戸市松戸１２３０−１ピアザ松戸１Ｆ
ｎａｍｃｏ梅田店,大阪府大阪市北区小松原町３−３ＯＳビル２Ｆ
ｎａｍｃｏ池袋店ＲＥＤ,東京都豊島区東池袋１−２２−１０　ＨＵＭＡＸパビリオン１Ｆ
ｎａｍｃｏ流山おおたかの森Ｓ・Ｃ店,千葉県流山市おおたかの森南１−５−１おおたかの森Ｓ・Ｃ３Ｆ
ｎａｍｃｏ熊谷店,埼玉県熊谷市銀座2-97CARPA1階
